"original_text","perturbed_text","original_score","perturbed_score","original_output","perturbed_output","ground_truth_output","num_queries","result_type"
"partway through watching this saccharine , easter-egg-colored concoction , you realize that it is made up of three episodes of a rejected tv [[show]] . ","partway through watching this saccharine , easter-egg-colored concoction , you realize that it is made up of three episodes of a rejected tv [[shw]] . ",0.42527127265930176,0.5473579168319702,0,1,0,510,"Successful"
"for the most part , it 's a work of incendiary genius , steering [[clear]] of knee-jerk reactions and quick solutions . ","for the most part , it 's a work of incendiary genius , steering [[cXlear]] of knee-jerk reactions and quick solutions . ",0.18132436275482178,0.40165239572525024,1,1,1,362,"Failed"
"the special effects and many scenes of weightlessness look as good or better than in the [[original]] , while the oscar-winning sound and james horner 's rousing score make good use of the hefty audio system . ","the special effects and many scenes of weightlessness look as good or better than in the [[odiginal]] , while the oscar-winning sound and james horner 's rousing score make good use of the hefty audio system . ",0.3580164313316345,0.5078878402709961,1,0,1,638,"Successful"
"not since freddy got fingered has a major release been so [[painful]] to sit through . ","not since freddy got fingered has a major release been so [[pZainful]] to sit through . ",0.01074141263961792,0.14691466093063354,0,0,0,207,"Failed"
"the movie is what happens when you [[blow]] up small potatoes to 10 times their natural size , and it ai n't pretty . ","the movie is what happens when you [[bow]] up small potatoes to 10 times their natural size , and it ai n't pretty . ",0.34820038080215454,0.7231922745704651,0,1,0,232,"Successful"
"we have n't seen such [[hilarity]] since say it is n't so ! ","we have n't seen such [[hCilarity]] since say it is n't so ! ",0.046613216400146484,0.3045397400856018,1,1,1,81,"Failed"
"to [[call]] the other side of heaven `` appalling '' would be to underestimate just how dangerous entertainments like it can be . ","to [[cal]] the other side of heaven `` appalling '' would be to underestimate just how dangerous entertainments like it can be . ",0.3642076253890991,0.7210748791694641,0,1,0,374,"Successful"
"[[nothing]] is sacred in this gut-buster . ","[[notting]] is sacred in this gut-buster . ",0.4029172658920288,0.5119260549545288,0,1,0,129,"Successful"
"feels [[haphazard]] , as if the writers mistakenly thought they could achieve an air of frantic spontaneity by simply tossing in lots of characters doing silly stuff and stirring the pot . ","feels [[hXaphazard]] , as if the writers mistakenly thought they could achieve an air of frantic spontaneity by simply tossing in lots of characters doing silly stuff and stirring the pot . ",0.318203330039978,0.46177250146865845,0,0,0,613,"Failed"
"[[tries]] to add some spice to its quirky sentiments but the taste is all too familiar . ","[[triss]] to add some spice to its quirky sentiments but the taste is all too familiar . ",0.17151516675949097,0.5206103324890137,0,1,0,203,"Successful"
"at its [[worst]] , it implodes in a series of very bad special effects . ","at its [[wborst]] , it implodes in a series of very bad special effects . ",0.042227327823638916,0.06420671939849854,0,0,0,173,"Failed"
"with tightly organized efficiency , numerous flashbacks and a constant edge of tension , [[miller]] 's film is one of 2002 's involvingly adult surprises . ","with tightly organized efficiency , numerous flashbacks and a constant edge of tension , [[milker]] 's film is one of 2002 's involvingly adult surprises . ",0.05025827884674072,0.4385780692100525,1,1,1,560,"Failed"
"a great ensemble cast ca n't lift this heartfelt enterprise out of the familiar . ","a great ensemble cast ca n't lift this heartfelt enterprise out of the familiar . ",0.8685532808303833,0.8685532808303833,1,1,0,1,"Skipped"
"a [[warm]] but realistic meditation on friendship , family and affection . ","a [[wadm]] but realistic meditation on friendship , family and affection . ",7.700920104980469e-05,0.0005873441696166992,1,1,1,287,"Failed"
"at times , the suspense is palpable , but by the end there 's a sense that the crux of the mystery hinges on a technicality that strains credulity and leaves the viewer [[haunted]] by the waste of potential . ","at times , the suspense is palpable , but by the end there 's a sense that the crux of the mystery hinges on a technicality that strains credulity and leaves the viewer [[hunted]] by the waste of potential . ",0.08085095882415771,0.21765559911727905,0,0,0,570,"Failed"
"while the resident evil games may have set new standards for thrills , suspense , and gore for video games , the movie really only succeeds in the third of these . ","while the resident evil games may have set new standards for thrills , suspense , and gore for video games , the movie really only succeeds in the third of these . ",0.996829628944397,0.996829628944397,1,1,0,1,"Skipped"
"it 's a remarkably [[solid]] and subtly satirical tour de force . ","it 's a remarkably [[sTolid]] and subtly satirical tour de force . ",0.00030517578125,0.008053839206695557,1,1,1,200,"Failed"
"director andrew niccol ... demonstrates a wry understanding of the quirks of fame . ","director andrew niccol ... demonstrates a wry understanding of the quirks of fame . ",0.7298447489738464,0.7298447489738464,0,0,1,1,"Skipped"
"when leguizamo finally plugged an [[irritating]] character late in the movie . ","when leguizamo finally plugged an [[irrigating]] character late in the movie . ",0.008570969104766846,0.09075015783309937,0,0,0,280,"Failed"
"thekids will probably stay amused at the kaleidoscope of big , [[colorful]] characters . ","thekids will probably stay amused at the kaleidoscope of big , [[cNolorful]] characters . ",0.30569523572921753,0.630336582660675,1,0,1,320,"Successful"
"mattei is tiresomely [[grave]] and long-winded , as if circularity itself indicated profundity . ","mattei is tiresomely [[grace]] and long-winded , as if circularity itself indicated profundity . ",0.03200298547744751,0.4311680793762207,0,0,0,369,"Failed"
"... [[plays]] like somebody spliced random moments of a chris rock routine into what is otherwise a cliche-riddled but self-serious spy thriller . ","... [[pays]] like somebody spliced random moments of a chris rock routine into what is otherwise a cliche-riddled but self-serious spy thriller . ",0.13860201835632324,0.5051581859588623,0,1,0,529,"Successful"
"an overemphatic , would-be wacky , ultimately [[tedious]] sex farce . ","an overemphatic , would-be wacky , ultimately [[tJedious]] sex farce . ",0.0011664032936096191,0.04450702667236328,0,0,0,261,"Failed"
"it all [[adds]] up to good fun . ","it all [[aJdds]] up to good fun . ",0.0004968643188476562,0.020995616912841797,1,1,1,29,"Failed"
"[[whether]] writer-director anne fontaine 's film is a ghost story , an account of a nervous breakdown , a trip down memory lane , all three or none of the above , it is as seductive as it is haunting . ","[[wbether]] writer-director anne fontaine 's film is a ghost story , an account of a nervous breakdown , a trip down memory lane , all three or none of the above , it is as seductive as it is haunting . ",0.43426138162612915,0.7142958641052246,1,0,1,581,"Successful"
"another in-your-face wallow in the lower depths made by people who have never sung those [[blues]] . ","another in-your-face wallow in the lower depths made by people who have never sung those [[bles]] . ",0.09993875026702881,0.3544342517852783,0,0,0,287,"Failed"
"a very [[well-made]] , funny and entertaining picture . ","a very [[wWell-made]] , funny and entertaining picture . ",0.0019890666007995605,0.07985848188400269,1,1,1,179,"Failed"
"it 's worth seeing just on the basis of the wisdom , and at times , the startling optimism , of the children . ","it 's worth seeing just on the basis of the wisdom , and at times , the startling optimism , of the children . ",0.5180637836456299,0.5180637836456299,0,0,1,1,"Skipped"
"despite its title , punch-drunk love is never heavy-handed . ","despite its title , punch-drunk love is never heavy-handed . ",0.9846851825714111,0.9846851825714111,0,0,1,1,"Skipped"
"if director michael dowse only superficially understands his characters , he does n't hold them in contempt . ","if director michael dowse only superficially understands his characters , he does n't hold them in contempt . ",0.8474861979484558,0.8474861979484558,1,1,0,1,"Skipped"
"it 's [[refreshing]] to see a girl-power movie that does n't feel it has to prove anything . ","it 's [[rCefreshing]] to see a girl-power movie that does n't feel it has to prove anything . ",0.028910934925079346,0.3173246383666992,1,1,1,224,"Failed"
"the film may appear naked in its narrative [[form]] ... but it goes deeper than that , to fundamental choices that include the complexity of the catholic doctrine ","the film may appear naked in its narrative [[fkrm]] ... but it goes deeper than that , to fundamental choices that include the complexity of the catholic doctrine ",0.2994152307510376,0.5875681042671204,1,0,1,460,"Successful"
"however it may please those who love movies that blare with pop songs , young science fiction fans will stomp away in disgust . ","however it may please those who love movies that blare with pop songs , young science fiction fans will stomp away in disgust . ",0.8493695259094238,0.8493695259094238,1,1,0,1,"Skipped"
"as vulgar as it is [[banal]] . ","as vulgar as it is [[bahal]] . ",0.05453646183013916,0.8254408240318298,0,1,0,55,"Successful"
"zhang ... has done an [[amazing]] job of getting realistic performances from his mainly nonprofessional cast . ","zhang ... has done an [[aamzing]] job of getting realistic performances from his mainly nonprofessional cast . ",0.001292109489440918,0.04024618864059448,1,1,1,385,"Failed"
"outer-space buffs might love this film , but others will find its pleasures intermittent . ","outer-space buffs might love this film , but others will find its pleasures intermittent . ",0.9882530570030212,0.9882530570030212,1,1,0,1,"Skipped"
"maud and roland 's search for an unknowable past makes for a haunting literary detective story , but labute pulls off a neater trick in possession : he makes language sexy . ","maud and roland 's search for an unknowable past makes for a haunting literary detective story , but labute pulls off a neater trick in possession : he makes language sexy . ",0.7262818813323975,0.7262818813323975,0,0,1,1,"Skipped"
"more [[whiny]] downer than corruscating commentary . ","more [[winy]] downer than corruscating commentary . ",0.006158947944641113,0.04719996452331543,0,0,0,185,"Failed"
"there are simply too many [[ideas]] floating around -- part farce , part sliding doors , part pop video -- and yet failing to exploit them . ","there are simply too many [[ides]] floating around -- part farce , part sliding doors , part pop video -- and yet failing to exploit them . ",0.1470535397529602,0.2601233124732971,0,0,0,358,"Failed"
"it 's another stale , kill-by-numbers flick , complete with blade-thin characters and [[terrible]] , pun-laden dialogue . ","it 's another stale , kill-by-numbers flick , complete with blade-thin characters and [[terrile]] , pun-laden dialogue . ",0.01815783977508545,0.17948460578918457,0,0,0,472,"Failed"
"what distinguishes time of favor from countless other thrillers is its underlying concern with the consequences of words and with the complicated [[emotions]] fueling terrorist acts . ","what distinguishes time of favor from countless other thrillers is its underlying concern with the consequences of words and with the complicated [[efmotions]] fueling terrorist acts . ",0.1094927191734314,0.45738857984542847,1,1,1,643,"Failed"
"i do n't mind having my heartstrings pulled , but do n't treat me like a [[fool]] . ","i do n't mind having my heartstrings pulled , but do n't treat me like a [[foil]] . ",0.0960695743560791,0.29727381467819214,0,0,0,174,"Failed"
"the movie 's accumulated force still feels like an [[ugly]] knot tightening in your stomach . ","the movie 's accumulated force still feels like an [[ubly]] knot tightening in your stomach . ",0.01818108558654785,0.2273511290550232,0,0,0,294,"Failed"
"at least one scene is so [[disgusting]] that viewers may be hard pressed to retain their lunch . ","at least one scene is so [[dBisgusting]] that viewers may be hard pressed to retain their lunch . ",0.06257390975952148,0.586132824420929,0,1,0,262,"Successful"
"it has [[charm]] to spare , and unlike many romantic comedies , it does not alienate either gender in the audience . ","it has [[cahrm]] to spare , and unlike many romantic comedies , it does not alienate either gender in the audience . ",0.08683407306671143,0.697831392288208,1,0,1,336,"Successful"
"an operatic , [[sprawling]] picture that 's entertainingly acted , magnificently shot and gripping enough to sustain most of its 170-minute length . ","an operatic , [[sUprawling]] picture that 's entertainingly acted , magnificently shot and gripping enough to sustain most of its 170-minute length . ",0.0030892491340637207,0.01863408088684082,1,1,1,538,"Failed"
"a [[giggle]] a minute . ","a [[gNiggle]] a minute . ",0.04201728105545044,0.67200767993927,1,0,1,63,"Successful"
"uses [[sharp]] humor and insight into human nature to examine class conflict , adolescent yearning , the roots of friendship and sexual identity . ","uses [[sSharp]] humor and insight into human nature to examine class conflict , adolescent yearning , the roots of friendship and sexual identity . ",0.0010221004486083984,0.006059527397155762,1,1,1,536,"Failed"
"the continued good chemistry between [[carmen]] and juni is what keeps this slightly disappointing sequel going , with enough amusing banter -- blessedly curse-free -- to keep both kids and parents entertained . ","the continued good chemistry between [[cadmen]] and juni is what keeps this slightly disappointing sequel going , with enough amusing banter -- blessedly curse-free -- to keep both kids and parents entertained . ",0.12672162055969238,0.3762708902359009,1,1,1,714,"Failed"
"i 'm just too [[bored]] to care . ","i 'm just too [[bred]] to care . ",0.003810703754425049,0.0052117109298706055,0,0,0,38,"Failed"
"one of the more [[irritating]] cartoons you will see this , or any , year . ","one of the more [[irrigating]] cartoons you will see this , or any , year . ",0.02430737018585205,0.39192652702331543,0,0,0,118,"Failed"
"it 's one [[heck]] of a character study -- not of hearst or davies but of the unique relationship between them . ","it 's one [[hedk]] of a character study -- not of hearst or davies but of the unique relationship between them . ",0.08577126264572144,0.37340253591537476,1,1,1,267,"Failed"
"it moves quickly , adroitly , and without fuss ; it does n't give you time to reflect on the inanity -- and the cold war datedness -- of its premise . ","it moves quickly , adroitly , and without fuss ; it does n't give you time to reflect on the inanity -- and the cold war datedness -- of its premise . ",0.8650754690170288,0.8650754690170288,0,0,1,1,"Skipped"
"i am [[sorry]] that i was unable to get the full brunt of the comedy . ","i am [[sorey]] that i was unable to get the full brunt of the comedy . ",0.013193666934967041,0.08740729093551636,0,0,0,115,"Failed"
"a good [[piece]] of work more often than not . ","a good [[pjece]] of work more often than not . ",0.01094728708267212,0.24603557586669922,1,1,1,73,"Failed"
"while the ideas about techno-saturation are far from [[novel]] , they 're presented with a wry dark humor . ","while the ideas about techno-saturation are far from [[nivel]] , they 're presented with a wry dark humor . ",0.07248508930206299,0.2119261622428894,1,1,1,252,"Failed"
"[[charles]] ' entertaining film chronicles seinfeld 's return to stand-up comedy after the wrap of his legendary sitcom , alongside wannabe comic adams ' attempts to get his shot at the big time . ","[[cahrles]] ' entertaining film chronicles seinfeld 's return to stand-up comedy after the wrap of his legendary sitcom , alongside wannabe comic adams ' attempts to get his shot at the big time . ",0.46546393632888794,0.8368606567382812,1,0,1,649,"Successful"
"an exhilarating futuristic thriller-noir , minority report twists the best of technology around a gripping story , delivering a [[riveting]] , pulse intensifying escapist adventure of the first order ","an exhilarating futuristic thriller-noir , minority report twists the best of technology around a gripping story , delivering a [[rIiveting]] , pulse intensifying escapist adventure of the first order ",0.0020951032638549805,0.012105762958526611,1,1,1,856,"Failed"
"[[beautifully]] observed , miraculously unsentimental comedy-drama . ","[[bQeautifully]] observed , miraculously unsentimental comedy-drama . ",0.0008981227874755859,0.08450073003768921,1,1,1,351,"Failed"
"the film 's hackneyed message is not helped by the thin characterizations , nonexistent plot and [[pretentious]] visual style . ","the film 's hackneyed message is not helped by the thin characterizations , nonexistent plot and [[pdetentious]] visual style . ",0.010172128677368164,0.03424888849258423,0,0,0,478,"Failed"
"a breezy romantic comedy that has the punch of a [[good]] sitcom , while offering exceptionally well-detailed characters . ","a breezy romantic comedy that has the punch of a [[giod]] sitcom , while offering exceptionally well-detailed characters . ",0.003338336944580078,0.02420353889465332,1,1,1,429,"Failed"
"should have been someone [[else]] - ","should have been someone [[ese]] - ",0.023791074752807617,0.09355980157852173,0,0,0,51,"Failed"
"coughs and [[sputters]] on its own postmodern conceit . ","coughs and [[spitters]] on its own postmodern conceit . ",0.37588977813720703,0.4880453944206238,0,0,0,176,"Failed"
"the lion [[king]] was a roaring success when it was released eight years ago , but on imax it seems better , not just bigger . ","the lion [[kong]] was a roaring success when it was released eight years ago , but on imax it seems better , not just bigger . ",0.15581685304641724,0.5842843055725098,1,0,1,295,"Successful"
"almost [[gags]] on its own gore . ","almost [[gars]] on its own gore . ",0.0011051297187805176,0.15035218000411987,0,0,0,61,"Failed"
"a [[marvel]] like none you 've seen . ","a [[mqrvel]] like none you 've seen . ",0.36373788118362427,0.9147803783416748,1,0,1,73,"Successful"
"[[trite]] , banal , cliched , mostly inoffensive . ","[[trife]] , banal , cliched , mostly inoffensive . ",0.0022679567337036133,0.0057735443115234375,0,0,0,187,"Failed"
"immersing us in the endlessly inventive , fiercely competitive world of hip-hop djs , the project is [[sensational]] and revelatory , even if scratching makes you itch . ","immersing us in the endlessly inventive , fiercely competitive world of hip-hop djs , the project is [[sdnsational]] and revelatory , even if scratching makes you itch . ",0.003498673439025879,0.014144361019134521,1,1,1,603,"Failed"
"the movie has an infectious exuberance that will engage anyone with a passing interest in the skate/surf culture , the l.a. beach scene and the imaginative ( and sometimes illegal ) [[ways]] kids can make a playground out of the refuse of adults . ","the movie has an infectious exuberance that will engage anyone with a passing interest in the skate/surf culture , the l.a. beach scene and the imaginative ( and sometimes illegal ) [[was]] kids can make a playground out of the refuse of adults . ",0.17368513345718384,0.3976702094078064,1,1,1,746,"Failed"
"yakusho and shimizu ... create engaging characterizations in imamura 's lively and [[enjoyable]] cultural mix . ","yakusho and shimizu ... create engaging characterizations in imamura 's lively and [[ebjoyable]] cultural mix . ",0.00018650293350219727,0.001620650291442871,1,1,1,441,"Failed"
"this is wild surreal stuff , but brilliant and the camera just kind of sits there and lets you look at this and its like you 're going from one room to the next and none of them have any relation to the other . ","this is wild surreal stuff , but brilliant and the camera just kind of sits there and lets you look at this and its like you 're going from one room to the next and none of them have any relation to the other . ",0.5734765529632568,0.5734765529632568,0,0,1,1,"Skipped"
"there is very little dread or apprehension , and though i like the creepy ideas , they are not executed with anything more than [[perfunctory]] skill . ","there is very little dread or apprehension , and though i like the creepy ideas , they are not executed with anything more than [[pcerfunctory]] skill . ",0.20723772048950195,0.3886128067970276,0,0,0,411,"Failed"
"the notion that bombing buildings is the funniest thing in the world goes entirely unexamined in this startlingly [[unfunny]] comedy . ","the notion that bombing buildings is the funniest thing in the world goes entirely unexamined in this startlingly [[uFnfunny]] comedy . ",0.17287206649780273,0.7291612029075623,0,1,0,464,"Successful"
"good car chases , great [[fight]] scenes , and a distinctive blend of european , american and asian influences . ","good car chases , great [[fght]] scenes , and a distinctive blend of european , american and asian influences . ",0.0031173229217529297,0.04289448261260986,1,1,1,390,"Failed"
"the last 20 minutes are somewhat redeeming , but most of the movie is the same teenage american road-trip drek we 've seen before - only this time you have to read the fart [[jokes]] ","the last 20 minutes are somewhat redeeming , but most of the movie is the same teenage american road-trip drek we 've seen before - only this time you have to read the fart [[joes]] ",0.02526301145553589,0.21532940864562988,0,0,0,402,"Failed"
"even in its most tedious scenes , russian ark is mesmerizing . ","even in its most tedious scenes , russian ark is mesmerizing . ",0.7497522830963135,0.7497522830963135,0,0,1,1,"Skipped"
"with its [[dogged]] hollywood naturalism and the inexorable passage of its characters toward sainthood , windtalkers is nothing but a sticky-sweet soap . ","with its [[digged]] hollywood naturalism and the inexorable passage of its characters toward sainthood , windtalkers is nothing but a sticky-sweet soap . ",0.08906227350234985,0.13218587636947632,0,0,0,589,"Failed"
"generally , clockstoppers will fulfill your wildest fantasies about being a different kind of time [[traveler]] , while happily killing 94 minutes . ","generally , clockstoppers will fulfill your wildest fantasies about being a different kind of time [[tPraveler]] , while happily killing 94 minutes . ",0.16637194156646729,0.5194697380065918,1,0,1,496,"Successful"
"something akin to a japanese alice through the looking glass , except that it seems to take itself far more seriously . ","something akin to a japanese alice through the looking glass , except that it seems to take itself far more seriously . ",0.8532191514968872,0.8532191514968872,0,0,1,1,"Skipped"
"oh [[come]] on . ","oh [[cone]] on . ",0.36589038372039795,0.5446913242340088,0,1,0,13,"Successful"
"a moody , multi-dimensional love story and sci-fi mystery , solaris is a [[thought-provoking]] , haunting film that allows the seeds of the imagination to germinate . ","a moody , multi-dimensional love story and sci-fi mystery , solaris is a [[tbought-provoking]] , haunting film that allows the seeds of the imagination to germinate . ",0.08055752515792847,0.33574193716049194,1,1,1,616,"Failed"
"not only are the special effects and narrative flow much [[improved]] , and daniel radcliffe more emotionally assertive this time around as harry , but the film conjures the magic of author j.k. rowling 's books . ","not only are the special effects and narrative flow much [[igmproved]] , and daniel radcliffe more emotionally assertive this time around as harry , but the film conjures the magic of author j.k. rowling 's books . ",0.2781156301498413,0.7471631765365601,1,0,1,637,"Successful"
"it 's clear the filmmakers were n't sure where they wanted their story to go , and even more clear that they [[lack]] the skills to get us to this undetermined destination . ","it 's clear the filmmakers were n't sure where they wanted their story to go , and even more clear that they [[laDck]] the skills to get us to this undetermined destination . ",0.45683276653289795,0.6374647617340088,0,1,0,372,"Successful"
"( t ) his beguiling belgian fable , very much its own droll and delicate little film , has some [[touching]] things to say about what is important in life and why . ","( t ) his beguiling belgian fable , very much its own droll and delicate little film , has some [[tYouching]] things to say about what is important in life and why . ",0.2493540644645691,0.7446752786636353,1,0,1,384,"Successful"
"even on those rare occasions when the narrator stops yammering , miller 's hand often [[feels]] unsure . ","even on those rare occasions when the narrator stops yammering , miller 's hand often [[fels]] unsure . ",0.14311814308166504,0.30089712142944336,0,0,0,310,"Failed"
"( chaiken 's ) talent lies in an evocative , accurate observation of a distinctive milieu and in the [[lively]] , convincing dialogue she creates for her characters . ","( chaiken 's ) talent lies in an evocative , accurate observation of a distinctive milieu and in the [[liIvely]] , convincing dialogue she creates for her characters . ",0.001629650592803955,0.01367110013961792,1,1,1,587,"Failed"
