"original_text","perturbed_text","original_score","perturbed_score","original_output","perturbed_output","ground_truth_output","num_queries","result_type"
"an important movie , a reminder of the [[power]] of film to move us and to make us examine our values . ","an important movie , a reminder of the [[piwer]] of film to move us and to make us examine our values . ",0.10250169038772583,0.3073766231536865,1,1,1,246,"Failed"
"the magic of the film lies not in the mysterious spring but in the richness of its performances . ","the magic of the film lies not in the mysterious spring but in the richness of its performances . ",0.7506073713302612,0.7506073713302612,0,0,1,1,"Skipped"
"this re-do is so [[dumb]] and so exploitative in its violence that , ironically , it becomes everything that the rather clumsy original was railing against . ","this re-do is so [[dmb]] and so exploitative in its violence that , ironically , it becomes everything that the rather clumsy original was railing against . ",0.007598876953125,0.019070923328399658,0,0,0,451,"Failed"
"the jabs it employs are short , carefully placed and dead-center . ","the jabs it employs are short , carefully placed and dead-center . ",0.9065380096435547,0.9065380096435547,0,0,1,1,"Skipped"
"while locals will get a kick out of spotting cleveland sites , the rest of the world will enjoy a fast-paced comedy with quirks that might make the award-winning coen [[brothers]] envious . ","while locals will get a kick out of spotting cleveland sites , the rest of the world will enjoy a fast-paced comedy with quirks that might make the award-winning coen [[bothers]] envious . ",0.0664522647857666,0.30291807651519775,1,1,1,556,"Failed"
"the words , ` frankly , my dear , i do n't give a damn , ' have never been more appropriate . ","the words , ` frankly , my dear , i do n't give a damn , ' have never been more appropriate . ",0.59865403175354,0.59865403175354,1,1,0,1,"Skipped"
"the longer the movie goes , the [[worse]] it gets , but it 's actually pretty good in the first few minutes . ","the longer the movie goes , the [[woese]] it gets , but it 's actually pretty good in the first few minutes . ",0.02457481622695923,0.1321268081665039,0,0,0,251,"Failed"
"too much of the humor falls [[flat]] . ","too much of the humor falls [[fat]] . ",0.0003802776336669922,0.006726741790771484,0,0,0,68,"Failed"
"further proof that the epicenter of cool , beautiful , [[thought-provoking]] foreign cinema is smack-dab in the middle of dubya 's axis of evil . ","further proof that the epicenter of cool , beautiful , [[tDhought-provoking]] foreign cinema is smack-dab in the middle of dubya 's axis of evil . ",0.011680841445922852,0.18298012018203735,1,1,1,451,"Failed"
"the film 's few ideas are stretched to the point of evaporation ; the whole central [[section]] is one big chase that seems to have no goal and no urgency . ","the film 's few ideas are stretched to the point of evaporation ; the whole central [[scection]] is one big chase that seems to have no goal and no urgency . ",0.14528560638427734,0.2553749680519104,0,0,0,379,"Failed"
"too [[slow]] , too long and too little happens . ","too [[siow]] , too long and too little happens . ",0.0011664032936096191,0.011013507843017578,0,0,0,85,"Failed"
"due to some script weaknesses and the casting of the director 's [[brother]] , the film trails off into inconsequentiality . ","due to some script weaknesses and the casting of the director 's [[bErother]] , the film trails off into inconsequentiality . ",0.39232951402664185,0.4152343273162842,0,0,0,383,"Failed"
"very bad . ","very bad . ",0.11066544055938721,0.11066544055938721,0,0,0,1,"Failed"
"a lackluster , unessential [[sequel]] to the classic disney adaptation of j.m. barrie 's peter pan . ","a lackluster , unessential [[sQequel]] to the classic disney adaptation of j.m. barrie 's peter pan . ",0.12554925680160522,0.5281617641448975,0,1,0,350,"Successful"
"a science-fiction pastiche so lacking in originality that if you stripped away its inspirations there would be precious little [[left]] . ","a science-fiction pastiche so lacking in originality that if you stripped away its inspirations there would be precious little [[leet]] . ",0.4216155409812927,0.5093223452568054,0,1,0,495,"Successful"
"birthday girl is an [[amusing]] joy ride , with some surprisingly violent moments . ","birthday girl is an [[ajusing]] joy ride , with some surprisingly violent moments . ",0.004899561405181885,0.0434531569480896,1,1,1,271,"Failed"
"so much facile technique , such cute ideas , so little movie . ","so much facile technique , such cute ideas , so little movie . ",0.836745023727417,0.836745023727417,0,0,1,1,"Skipped"
"expect the same-old , lame-old slasher nonsense , just with different [[scenery]] . ","expect the same-old , lame-old slasher nonsense , just with different [[sJcenery]] . ",0.21320748329162598,0.329728364944458,0,0,0,286,"Failed"
"a smart , [[witty]] follow-up . ","a smart , [[wifty]] follow-up . ",0.001316845417022705,0.3298985958099365,1,1,1,87,"Failed"
"chabrol has taken [[promising]] material for a black comedy and turned it instead into a somber chamber drama . ","chabrol has taken [[pUromising]] material for a black comedy and turned it instead into a somber chamber drama . ",0.029036641120910645,0.19586050510406494,0,0,0,371,"Failed"
"like mike is a winner for kids , and no doubt a [[winner]] for lil bow wow , who can now add movies to the list of things he does well . ","like mike is a winner for kids , and no doubt a [[wibner]] for lil bow wow , who can now add movies to the list of things he does well . ",0.011182308197021484,0.0691789984703064,1,1,1,219,"Failed"
"it 's another video movie photographed like a film , with the bad lighting that 's often written off as indie film naturalism . ","it 's another video movie photographed like a film , with the bad lighting that 's often written off as indie film naturalism . ",0.7299000024795532,0.7299000024795532,1,1,0,1,"Skipped"
"there 's not enough here to justify the [[almost]] two hours . ","there 's not enough here to justify the [[alost]] two hours . ",0.03867769241333008,0.06358981132507324,0,0,0,126,"Failed"
"it will grip even viewers who are n't interested in rap , as it cuts to the [[heart]] of american society in an unnerving way . ","it will grip even viewers who are n't interested in rap , as it cuts to the [[haert]] of american society in an unnerving way . ",0.07624548673629761,0.2629183530807495,1,1,1,301,"Failed"
"the film is beautifully mounted , but , more to the point , the issues are subtly presented , managing to walk a [[fine]] line with regard to the question of joan 's madness . ","the film is beautifully mounted , but , more to the point , the issues are subtly presented , managing to walk a [[fibe]] line with regard to the question of joan 's madness . ",0.07373028993606567,0.13729357719421387,1,1,1,486,"Failed"
"and if you 're not nearly moved to tears by a [[couple]] of scenes , you 've got ice water in your veins . ","and if you 're not nearly moved to tears by a [[ciuple]] of scenes , you 've got ice water in your veins . ",0.16184133291244507,0.44544726610183716,1,1,1,175,"Failed"
"richard gere and diane [[lane]] put in fine performances as does french actor oliver martinez . ","richard gere and diane [[lame]] put in fine performances as does french actor oliver martinez . ",0.012292325496673584,0.2947636842727661,1,1,1,307,"Failed"
"[[good]] film , but very glum . ","[[gopd]] film , but very glum . ",0.32405298948287964,0.8748250007629395,1,0,1,40,"Successful"
"there are plot [[holes]] big enough for shamu the killer whale to swim through . ","there are plot [[hopes]] big enough for shamu the killer whale to swim through . ",0.04218697547912598,0.15899991989135742,0,0,0,155,"Failed"
"preaches to two completely different choirs at the same time , which is a pretty [[amazing]] accomplishment . ","preaches to two completely different choirs at the same time , which is a pretty [[aRmazing]] accomplishment . ",0.013318181037902832,0.541015625,1,0,1,353,"Successful"
"verbinski implements [[every]] hack-artist trick to give us the ooky-spookies . ","verbinski implements [[evry]] hack-artist trick to give us the ooky-spookies . ",0.1374334692955017,0.14622241258621216,0,0,0,315,"Failed"
"two hours fly by -- opera 's a pleasure when you do n't have to endure intermissions -- and even a novice to the form comes away exhilarated . ","two hours fly by -- opera 's a pleasure when you do n't have to endure intermissions -- and even a novice to the form comes away exhilarated . ",0.837140679359436,0.837140679359436,0,0,1,1,"Skipped"
"in all , this is a watchable movie that 's not quite the memorable experience it might have been . ","in all , this is a watchable movie that 's not quite the memorable experience it might have been . ",0.9702340960502625,0.9702340960502625,1,1,0,1,"Skipped"
"drops you into a dizzying , volatile , pressure-cooker of a situation that quickly snowballs out of control , while focusing on the what much more than the why . ","drops you into a dizzying , volatile , pressure-cooker of a situation that quickly snowballs out of control , while focusing on the what much more than the why . ",0.8544767498970032,0.8544767498970032,0,0,1,1,"Skipped"
"atom egoyan has conjured up a multilayered work that tackles any number of [[fascinating]] issues ","atom egoyan has conjured up a multilayered work that tackles any number of [[faacinating]] issues ",0.046200335025787354,0.5665226578712463,1,0,1,354,"Successful"
"slick [[piece]] of cross-promotion . ","slick [[pXiece]] of cross-promotion . ",0.11773872375488281,0.7803453207015991,1,0,1,135,"Successful"
"well-nigh unendurable ... though the picture strains to become cinematic poetry , it remains depressingly prosaic and dull . ","well-nigh unendurable ... though the picture strains to become cinematic poetry , it remains depressingly prosaic and dull . ",0.5169811248779297,0.5169811248779297,1,1,0,1,"Skipped"
"majidi is an unconventional [[storyteller]] , capable of finding beauty in the most depressing places . ","majidi is an unconventional [[sXtoryteller]] , capable of finding beauty in the most depressing places . ",0.02917426824569702,0.6033686995506287,1,0,1,383,"Successful"
"the movie is n't just hilarious : it 's witty and [[inventive]] , too , and in hindsight , it is n't even all that dumb . ","the movie is n't just hilarious : it 's witty and [[ibventive]] , too , and in hindsight , it is n't even all that dumb . ",0.05607962608337402,0.6637556552886963,1,0,1,236,"Successful"
"filmmakers who can [[deftly]] change moods are treasures and even marvels . ","filmmakers who can [[dPeftly]] change moods are treasures and even marvels . ",0.042345643043518066,0.438414990901947,1,1,1,253,"Failed"
"the [[vitality]] of the actors keeps the intensity of the film high , even as the strafings blend together . ","the [[vutality]] of the actors keeps the intensity of the film high , even as the strafings blend together . ",0.24571877717971802,0.609618067741394,1,0,1,323,"Successful"
"( a ) [[shapeless]] blob of desperate entertainment . ","( a ) [[sahpeless]] blob of desperate entertainment . ",0.009843587875366211,0.10092133283615112,0,0,0,204,"Failed"
"in the end , the movie [[collapses]] on its shaky foundation despite the best efforts of director joe carnahan . ","in the end , the movie [[cillapses]] on its shaky foundation despite the best efforts of director joe carnahan . ",0.050136029720306396,0.2710479497909546,0,0,0,347,"Failed"
"[[true]] tale of courage -- and complicity -- at auschwitz is a harrowing drama that tries to tell of the unspeakable . ","[[trye]] tale of courage -- and complicity -- at auschwitz is a harrowing drama that tries to tell of the unspeakable . ",0.15364521741867065,0.6744456887245178,1,0,1,360,"Successful"
"a study in shades of gray , [[offering]] itself up in subtle plot maneuvers ... ","a study in shades of gray , [[oQffering]] itself up in subtle plot maneuvers ... ",0.0020409822463989258,0.02290499210357666,1,1,1,219,"Failed"
"no screen fantasy-adventure in recent memory has the showmanship of clones ' last 45 minutes . ","no screen fantasy-adventure in recent memory has the showmanship of clones ' last 45 minutes . ",0.652407169342041,0.652407169342041,0,0,1,1,"Skipped"
"more romantic , more emotional and ultimately more [[satisfying]] than the teary-eyed original . ","more romantic , more emotional and ultimately more [[sAatisfying]] than the teary-eyed original . ",0.0229913592338562,0.2590932250022888,1,1,1,325,"Failed"
"this is a shameless sham , calculated to cash in on the popularity of its stars . ","this is a shameless sham , calculated to cash in on the popularity of its stars . ",0.5643606781959534,0.5643606781959534,1,1,0,1,"Skipped"
"if you 've ever entertained the notion of doing what the title of this film implies , what sex with strangers actually shows may put you off the [[idea]] forever . ","if you 've ever entertained the notion of doing what the title of this film implies , what sex with strangers actually shows may put you off the [[isea]] forever . ",0.37728410959243774,0.4916338324546814,0,0,0,358,"Failed"
"once the 50 year old benigni [[appears]] as the title character , we find ourselves longing for the block of wood to come back . ","once the 50 year old benigni [[aYppears]] as the title character , we find ourselves longing for the block of wood to come back . ",0.04733997583389282,0.31882333755493164,0,0,0,273,"Failed"
"[[stultifyingly]] , dumbfoundingly , mind-numbingly bad . ","[[sctultifyingly]] , dumbfoundingly , mind-numbingly bad . ",0.035762250423431396,0.035762250423431396,0,0,0,270,"Failed"
"an effectively creepy , fear-inducing ( not fear-reducing ) film from japanese director hideo nakata , who takes the superstitious curse on chain letters and actually applies it . ","an effectively creepy , fear-inducing ( not fear-reducing ) film from japanese director hideo nakata , who takes the superstitious curse on chain letters and actually applies it . ",0.7486492395401001,0.7486492395401001,0,0,1,1,"Skipped"
"sustains its dreamlike glide through a succession of [[cheesy]] coincidences and voluptuous cheap effects , not the least of which is rebecca romijn-stamos . ","sustains its dreamlike glide through a succession of [[chessy]] coincidences and voluptuous cheap effects , not the least of which is rebecca romijn-stamos . ",0.23153561353683472,0.7659223079681396,0,1,0,555,"Successful"
"because of an unnecessary and [[clumsy]] last scene , ` swimfan ' left me with a very bad feeling . ","because of an unnecessary and [[cElumsy]] last scene , ` swimfan ' left me with a very bad feeling . ",0.0064547061920166016,0.046626150608062744,0,0,0,228,"Failed"
"no aspirations to social [[import]] inform the movie version . ","no aspirations to social [[iZmport]] inform the movie version . ",0.008218228816986084,0.014352560043334961,0,0,0,215,"Failed"
"sit through this one , and you wo n't need a magic watch to stop time ; your dvd player will do it for you . ","sit through this one , and you wo n't need a magic watch to stop time ; your dvd player will do it for you . ",0.958223283290863,0.958223283290863,1,1,0,1,"Skipped"
"for the first time in years , de [[niro]] digs deep emotionally , perhaps because he 's been stirred by the powerful work of his co-stars . ","for the first time in years , de [[ngiro]] digs deep emotionally , perhaps because he 's been stirred by the powerful work of his co-stars . ",0.2501901388168335,0.5655001401901245,1,0,1,349,"Successful"
"not since tom cruise in risky business has an actor made such a strong impression in his underwear . ","not since tom cruise in risky business has an actor made such a strong impression in his underwear . ",0.6726961135864258,0.6726961135864258,0,0,1,1,"Skipped"
"an interesting story with a pertinent ( cinematically [[unique]] ) message , told fairly well and scored to perfection , i found myself struggling to put my finger on that elusive `` missing thing . '' ","an interesting story with a pertinent ( cinematically [[uVnique]] ) message , told fairly well and scored to perfection , i found myself struggling to put my finger on that elusive `` missing thing . '' ",0.06231623888015747,0.2580203413963318,1,1,1,665,"Failed"
"... routine , harmless diversion and little else . ","... routine , harmless diversion and little else . ",0.7859041690826416,0.7859041690826416,0,0,1,1,"Skipped"
"is the time really ripe for a warmed-over james bond adventure , with a village idiot as the 007 clone ? ","is the time really ripe for a warmed-over james bond adventure , with a village idiot as the 007 clone ? ",0.7777171730995178,0.7777171730995178,1,1,0,1,"Skipped"
"even the finest chef ca n't make a hotdog into anything more than a hotdog , and robert de niro ca n't make this movie anything more than a trashy cop buddy comedy . ","even the finest chef ca n't make a hotdog into anything more than a hotdog , and robert de niro ca n't make this movie anything more than a trashy cop buddy comedy . ",0.8844371438026428,0.8844371438026428,1,1,0,1,"Skipped"
"the [[reality]] of the new live-action pinocchio he directed , cowrote and starred in borders on the grotesque . ","the [[realty]] of the new live-action pinocchio he directed , cowrote and starred in borders on the grotesque . ",0.06222158670425415,0.3653556704521179,0,0,0,367,"Failed"
"samira makhmalbaf 's new film blackboards is much like the ethos of a stream of consciousness , although , it 's [[unfortunate]] for the viewer that the thoughts and reflections coming through are torpid and banal ","samira makhmalbaf 's new film blackboards is much like the ethos of a stream of consciousness , although , it 's [[ubfortunate]] for the viewer that the thoughts and reflections coming through are torpid and banal ",0.3499795198440552,0.5137794613838196,0,1,0,696,"Successful"
"a [[bloated]] gasbag thesis grotesquely impressed by its own gargantuan aura of self-importance ... ","a [[boated]] gasbag thesis grotesquely impressed by its own gargantuan aura of self-importance ... ",0.08094584941864014,0.48413848876953125,0,0,0,396,"Failed"
"every time you look , sweet [[home]] alabama is taking another bummer of a wrong turn . ","every time you look , sweet [[hime]] alabama is taking another bummer of a wrong turn . ",0.08375430107116699,0.6052386164665222,0,1,0,246,"Successful"
"how do you spell [[cliché]] ? ","how do you spell [[cWliché]] ? ",0.03661084175109863,0.49217307567596436,0,0,0,51,"Failed"
"no telegraphing is too [[obvious]] or simplistic for this movie . ","no telegraphing is too [[oObvious]] or simplistic for this movie . ",0.021953701972961426,0.02387094497680664,0,0,0,195,"Failed"
"director of photography benoit delhomme shot the movie in [[delicious]] colors , and the costumes and sets are grand . ","director of photography benoit delhomme shot the movie in [[ddlicious]] colors , and the costumes and sets are grand . ",0.0072907209396362305,0.07758396863937378,1,1,1,388,"Failed"
"i thought my own watch had stopped keeping time as i slogged my way through clockstoppers . ","i thought my own watch had stopped keeping time as i slogged my way through clockstoppers . ",0.816973090171814,0.816973090171814,1,1,0,1,"Skipped"
"less dizzying than just dizzy , the jaunt is practically over before it begins . ","less dizzying than just dizzy , the jaunt is practically over before it begins . ",0.5492213368415833,0.5492213368415833,1,1,0,1,"Skipped"
"overall the film feels like a low-budget tv [[pilot]] that could not find a buyer to play it on the tube . ","overall the film feels like a low-budget tv [[pLilot]] that could not find a buyer to play it on the tube . ",0.06442403793334961,0.14248937368392944,0,0,0,255,"Failed"
"they should have called it [[gutterball]] . ","they should have called it [[ghtterball]] . ",0.2900356650352478,0.29003578424453735,0,0,0,87,"Failed"
"corpus collosum -- while undeniably interesting -- wore out its welcome well before the end credits rolled about 45 minutes in . ","corpus collosum -- while undeniably interesting -- wore out its welcome well before the end credits rolled about 45 minutes in . ",0.9563307166099548,0.9563307166099548,1,1,0,1,"Skipped"
"( a ) n utterly [[charming]] and hilarious film that reminded me of the best of the disney comedies from the 60s . ","( a ) n utterly [[cQharming]] and hilarious film that reminded me of the best of the disney comedies from the 60s . ",0.027101874351501465,0.40229177474975586,1,1,1,291,"Failed"
"there 's too much falseness to the second half , and what began as an intriguing look at youth fizzles into a dull , [[ridiculous]] attempt at heart-tugging . ","there 's too much falseness to the second half , and what began as an intriguing look at youth fizzles into a dull , [[rYidiculous]] attempt at heart-tugging . ",0.39690589904785156,0.8696935176849365,0,1,0,458,"Successful"
"wince-inducing dialogue , thrift-shop costumes , prosthetic makeup by silly [[putty]] and kmart blue-light-special effects all conspire to test trekkie loyalty . ","wince-inducing dialogue , thrift-shop costumes , prosthetic makeup by silly [[pitty]] and kmart blue-light-special effects all conspire to test trekkie loyalty . ",0.23734480142593384,0.30506592988967896,0,0,0,707,"Failed"
"a rigorously structured and exquisitely filmed drama about a father and son connection that is a brief shooting [[star]] of love . ","a rigorously structured and exquisitely filmed drama about a father and son connection that is a brief shooting [[sMtar]] of love . ",0.0029643774032592773,0.018292486667633057,1,1,1,429,"Failed"
"this is [[human]] comedy at its most amusing , interesting and confirming . ","this is [[hhman]] comedy at its most amusing , interesting and confirming . ",0.0044446587562561035,0.08754944801330566,1,1,1,221,"Failed"
"whaley 's determination to immerse you in sheer , unrelenting wretchedness is exhausting . ","whaley 's determination to immerse you in sheer , unrelenting wretchedness is exhausting . ",0.9569057822227478,0.9569057822227478,1,1,0,1,"Skipped"
"worth watching for [[dong]] jie 's performance -- and for the way it documents a culture in the throes of rapid change . ","worth watching for [[dog]] jie 's performance -- and for the way it documents a culture in the throes of rapid change . ",0.24955523014068604,0.6999226808547974,1,0,1,325,"Successful"
"a poignant , artfully [[crafted]] meditation on mortality . ","a poignant , artfully [[cCrafted]] meditation on mortality . ",0.0013218522071838379,0.05004459619522095,1,1,1,250,"Failed"
"too restrained to be a freak show , too mercenary and obvious to be cerebral , too dull and [[pretentious]] to be engaging ... the isle defies an easy categorization . ","too restrained to be a freak show , too mercenary and obvious to be cerebral , too dull and [[pIretentious]] to be engaging ... the isle defies an easy categorization . ",0.10582739114761353,0.4221203923225403,0,0,0,530,"Failed"
"vera 's three actors -- mollà , gil and bardem -- excel in [[insightful]] , empathetic performances . ","vera 's three actors -- mollà , gil and bardem -- excel in [[ibsightful]] , empathetic performances . ",0.01449728012084961,0.09329402446746826,1,1,1,348,"Failed"
"it 's everything you do n't go to the movies for . ","it 's everything you do n't go to the movies for . ",0.624704122543335,0.624704122543335,1,1,0,1,"Skipped"
"( grant 's ) bumbling magic takes over the film , and it turns out to be another [[winning]] star vehicle . ","( grant 's ) bumbling magic takes over the film , and it turns out to be another [[wiRnning]] star vehicle . ",0.04314088821411133,0.6330872178077698,1,0,1,277,"Successful"
"it gets onto the screen just about as much of the novella as one could reasonably expect , and is [[engrossing]] and moving in its own right . ","it gets onto the screen just about as much of the novella as one could reasonably expect , and is [[ebgrossing]] and moving in its own right . ",0.3468446135520935,0.7851072549819946,1,0,1,332,"Successful"
"velocity represents everything wrong with '' independent film '' as a commodified , sold-out concept on the american filmmaking scene . ","velocity represents everything wrong with '' independent film '' as a commodified , sold-out concept on the american filmmaking scene . ",0.8852512240409851,0.8852512240409851,1,1,0,1,"Skipped"
"but taken as a [[stylish]] and energetic one-shot , the queen of the damned can not be said to suck . ","but taken as a [[sBtylish]] and energetic one-shot , the queen of the damned can not be said to suck . ",0.08041149377822876,0.672162652015686,1,0,1,243,"Successful"
"the piece plays as well as it does thanks in large [[measure]] to anspaugh 's three lead actresses . ","the piece plays as well as it does thanks in large [[mWeasure]] to anspaugh 's three lead actresses . ",0.16060906648635864,0.426155686378479,1,1,1,301,"Failed"
"suffocated by its fussy script and uptight characters , this [[musty]] adaptation is all the more annoying since it 's been packaged and sold back to us by hollywood . ","suffocated by its fussy script and uptight characters , this [[misty]] adaptation is all the more annoying since it 's been packaged and sold back to us by hollywood . ",0.2541905641555786,0.321247398853302,0,0,0,490,"Failed"
"but what are adults doing in the theater at all ? ","but what are adults doing in the theater at all ? ",0.8658514618873596,0.8658514618873596,1,1,0,1,"Skipped"
"like being trapped at a perpetual frat party ... how can something so [[gross]] be so boring ? ","like being trapped at a perpetual frat party ... how can something so [[groes]] be so boring ? ",0.011556446552276611,0.0536656379699707,0,0,0,244,"Failed"
