"original_text","perturbed_text","original_score","perturbed_score","original_output","perturbed_output","ground_truth_output","num_queries","result_type"
"an [[important]] movie , a reminder of the power of film to move us and to make us examine our values . ","an [[ijportant]] movie , a reminder of the power of film to move us and to make us examine our values . ",0.007022678852081299,0.02462947368621826,1,1,1,246,"Failed"
"the magic of the film lies not in the mysterious spring but in the richness of its performances . ","the magic of the film lies not in the mysterious spring but in the richness of its performances . ",0.8262652158737183,0.8262652158737183,0,0,1,1,"Skipped"
"this re-do is so dumb and so exploitative in its violence that , ironically , it becomes everything that the rather clumsy original was railing against . ","this re-do is so dumb and so exploitative in its violence that , ironically , it becomes everything that the rather clumsy original was railing against . ",0.8707554340362549,0.8707554340362549,1,1,0,1,"Skipped"
"the jabs it employs are short , carefully placed and dead-center . ","the jabs it employs are short , carefully placed and dead-center . ",0.7471628189086914,0.7471628189086914,0,0,1,1,"Skipped"
"while locals will get a kick out of spotting cleveland sites , the rest of the world will enjoy a fast-paced comedy with quirks that might make the award-winning coen [[brothers]] envious . ","while locals will get a kick out of spotting cleveland sites , the rest of the world will enjoy a fast-paced comedy with quirks that might make the award-winning coen [[bothers]] envious . ",0.024809539318084717,0.038129329681396484,1,1,1,556,"Failed"
"the words , ` frankly , my dear , i do n't give a [[damn]] , ' have never been more appropriate . ","the words , ` frankly , my dear , i do n't give a [[dan]] , ' have never been more appropriate . ",0.37071770429611206,0.45647865533828735,0,0,0,186,"Failed"
"the longer the movie goes , the worse it gets , but it 's actually pretty good in the first few minutes . ","the longer the movie goes , the worse it gets , but it 's actually pretty good in the first few minutes . ",0.5409605503082275,0.5409605503082275,1,1,0,1,"Skipped"
"too much of the humor falls [[flat]] . ","too much of the humor falls [[fat]] . ",0.002940237522125244,0.8479422926902771,0,1,0,68,"Successful"
"further proof that the epicenter of cool , beautiful , [[thought-provoking]] foreign cinema is smack-dab in the middle of dubya 's axis of evil . ","further proof that the epicenter of cool , beautiful , [[tDhought-provoking]] foreign cinema is smack-dab in the middle of dubya 's axis of evil . ",0.003042459487915039,0.14275509119033813,1,1,1,451,"Failed"
"the film 's few ideas are stretched to the point of evaporation ; the whole central section is one big chase that seems to have no [[goal]] and no urgency . ","the film 's few ideas are stretched to the point of evaporation ; the whole central section is one big chase that seems to have no [[goYal]] and no urgency . ",0.03041905164718628,0.0516543984413147,0,0,0,379,"Failed"
"too [[slow]] , too long and too little happens . ","too [[siow]] , too long and too little happens . ",0.00196152925491333,0.0663381814956665,0,0,0,85,"Failed"
"due to some script weaknesses and the casting of the director 's brother , the film [[trails]] off into inconsequentiality . ","due to some script weaknesses and the casting of the director 's brother , the film [[tails]] off into inconsequentiality . ",0.2964087128639221,0.3825678825378418,0,0,0,383,"Failed"
"very bad . ","very bad . ",0.1477758288383484,0.1477758288383484,0,0,0,1,"Failed"
"a lackluster , unessential [[sequel]] to the classic disney adaptation of j.m. barrie 's peter pan . ","a lackluster , unessential [[sdquel]] to the classic disney adaptation of j.m. barrie 's peter pan . ",0.25869518518447876,0.5129173994064331,0,1,0,350,"Successful"
"a [[science-fiction]] pastiche so lacking in originality that if you stripped away its inspirations there would be precious little left . ","a [[scLience-fiction]] pastiche so lacking in originality that if you stripped away its inspirations there would be precious little left . ",0.1344614028930664,0.5468631982803345,0,1,0,495,"Successful"
"[[birthday]] girl is an amusing joy ride , with some surprisingly violent moments . ","[[bidthday]] girl is an amusing joy ride , with some surprisingly violent moments . ",3.9577484130859375e-05,0.0002040266990661621,1,1,1,271,"Failed"
"so much facile technique , such cute ideas , so little movie . ","so much facile technique , such cute ideas , so little movie . ",0.6111338138580322,0.6111338138580322,0,0,1,1,"Skipped"
"expect the same-old , lame-old slasher nonsense , just with different scenery . ","expect the same-old , lame-old slasher nonsense , just with different scenery . ",0.5038095712661743,0.5038095712661743,1,1,0,1,"Skipped"
"a [[smart]] , witty follow-up . ","a [[sart]] , witty follow-up . ",0.003042936325073242,0.14659541845321655,1,1,1,87,"Failed"
"chabrol has taken promising material for a black comedy and turned it [[instead]] into a somber chamber drama . ","chabrol has taken promising material for a black comedy and turned it [[insead]] into a somber chamber drama . ",0.34289735555648804,0.6949883699417114,0,1,0,371,"Successful"
"like [[mike]] is a winner for kids , and no doubt a winner for lil bow wow , who can now add movies to the list of things he does well . ","like [[minke]] is a winner for kids , and no doubt a winner for lil bow wow , who can now add movies to the list of things he does well . ",0.005779623985290527,0.18668514490127563,1,1,1,219,"Failed"
"it 's another video movie photographed like a film , with the bad lighting that 's often written off as indie film naturalism . ","it 's another video movie photographed like a film , with the bad lighting that 's often written off as indie film naturalism . ",0.6055072546005249,0.6055072546005249,1,1,0,1,"Skipped"
"there 's not enough here to justify the [[almost]] two hours . ","there 's not enough here to justify the [[alost]] two hours . ",0.0055803656578063965,0.026529669761657715,0,0,0,126,"Failed"
"it will grip even viewers who are n't interested in rap , as it cuts to the [[heart]] of american society in an unnerving way . ","it will grip even viewers who are n't interested in rap , as it cuts to the [[hart]] of american society in an unnerving way . ",0.08902943134307861,0.12737661600112915,1,1,1,301,"Failed"
"the film is beautifully mounted , but , more to the point , the issues are subtly presented , managing to walk a fine line with regard to the question of [[joan]] 's madness . ","the film is beautifully mounted , but , more to the point , the issues are subtly presented , managing to walk a fine line with regard to the question of [[jJoan]] 's madness . ",0.19494223594665527,0.2954435348510742,1,1,1,486,"Failed"
"and if you 're not nearly [[moved]] to tears by a couple of scenes , you 've got ice water in your veins . ","and if you 're not nearly [[mMoved]] to tears by a couple of scenes , you 've got ice water in your veins . ",0.25613659620285034,0.38656604290008545,1,1,1,175,"Failed"
"richard gere and diane [[lane]] put in fine performances as does french actor oliver martinez . ","richard gere and diane [[lame]] put in fine performances as does french actor oliver martinez . ",0.0005542635917663574,0.6089739799499512,1,0,1,307,"Successful"
"[[good]] film , but very glum . ","[[gMood]] film , but very glum . ",0.025237083435058594,0.45306265354156494,1,1,1,40,"Failed"
"there are plot [[holes]] big enough for shamu the killer whale to swim through . ","there are plot [[holds]] big enough for shamu the killer whale to swim through . ",0.011652648448944092,0.054798781871795654,0,0,0,155,"Failed"
"preaches to two completely different choirs at the same time , which is a pretty amazing accomplishment . ","preaches to two completely different choirs at the same time , which is a pretty amazing accomplishment . ",0.7266584634780884,0.7266584634780884,0,0,1,1,"Skipped"
"verbinski implements every hack-artist [[trick]] to give us the ooky-spookies . ","verbinski implements every hack-artist [[tick]] to give us the ooky-spookies . ",0.3251640200614929,0.5649633407592773,0,1,0,315,"Successful"
"two hours fly by -- opera 's a pleasure when you do n't have to endure intermissions -- and even a novice to the form comes away exhilarated . ","two hours fly by -- opera 's a pleasure when you do n't have to endure intermissions -- and even a novice to the form comes away exhilarated . ",0.9037802219390869,0.9037802219390869,0,0,1,1,"Skipped"
"in all , this is a watchable movie that 's not quite the memorable experience it might have been . ","in all , this is a watchable movie that 's not quite the memorable experience it might have been . ",0.9295422434806824,0.9295422434806824,1,1,0,1,"Skipped"
"drops you into a dizzying , volatile , pressure-cooker of a situation that quickly snowballs out of control , while focusing on the what much more than the why . ","drops you into a dizzying , volatile , pressure-cooker of a situation that quickly snowballs out of control , while focusing on the what much more than the why . ",0.8267337679862976,0.8267337679862976,0,0,1,1,"Skipped"
"atom egoyan has conjured up a multilayered work that tackles any number of fascinating issues ","atom egoyan has conjured up a multilayered work that tackles any number of fascinating issues ",0.5565295219421387,0.5565295219421387,0,0,1,1,"Skipped"
"[[slick]] piece of cross-promotion . ","[[sick]] piece of cross-promotion . ",0.12104976177215576,0.5793780088424683,1,0,1,135,"Successful"
"well-nigh unendurable ... though the picture strains to become cinematic poetry , it remains [[depressingly]] prosaic and dull . ","well-nigh unendurable ... though the picture strains to become cinematic poetry , it remains [[ddpressingly]] prosaic and dull . ",0.052317142486572266,0.27712422609329224,0,0,0,504,"Failed"
"majidi is an [[unconventional]] storyteller , capable of finding beauty in the most depressing places . ","majidi is an [[ubconventional]] storyteller , capable of finding beauty in the most depressing places . ",0.01589864492416382,0.06086474657058716,1,1,1,383,"Failed"
"the movie is n't just hilarious : it 's witty and inventive , too , and in hindsight , it is n't even all that dumb . ","the movie is n't just hilarious : it 's witty and inventive , too , and in hindsight , it is n't even all that dumb . ",0.8992875218391418,0.8992875218391418,0,0,1,1,"Skipped"
"filmmakers who can [[deftly]] change moods are treasures and even marvels . ","filmmakers who can [[dbeftly]] change moods are treasures and even marvels . ",0.04043900966644287,0.21061700582504272,1,1,1,253,"Failed"
"the vitality of the actors keeps the intensity of the film high , even as the strafings blend together . ","the vitality of the actors keeps the intensity of the film high , even as the strafings blend together . ",0.6218633055686951,0.6218633055686951,0,0,1,1,"Skipped"
"( a ) shapeless blob of desperate entertainment . ","( a ) shapeless blob of desperate entertainment . ",0.5437772870063782,0.5437772870063782,1,1,0,1,"Skipped"
"in the end , the movie [[collapses]] on its shaky foundation despite the best efforts of director joe carnahan . ","in the end , the movie [[cZollapses]] on its shaky foundation despite the best efforts of director joe carnahan . ",0.027535617351531982,0.062232911586761475,0,0,0,347,"Failed"
"[[true]] tale of courage -- and complicity -- at auschwitz is a harrowing drama that tries to tell of the unspeakable . ","[[tXrue]] tale of courage -- and complicity -- at auschwitz is a harrowing drama that tries to tell of the unspeakable . ",0.08287543058395386,0.38607001304626465,1,1,1,360,"Failed"
"a study in shades of gray , offering itself up in subtle [[plot]] maneuvers ... ","a study in shades of gray , offering itself up in subtle [[pot]] maneuvers ... ",0.09360313415527344,0.5692862272262573,1,0,1,219,"Successful"
"no screen fantasy-adventure in recent memory has the showmanship of clones ' last 45 minutes . ","no screen fantasy-adventure in recent memory has the showmanship of clones ' last 45 minutes . ",0.974338710308075,0.974338710308075,0,0,1,1,"Skipped"
"more romantic , more emotional and ultimately more satisfying than the teary-eyed [[original]] . ","more romantic , more emotional and ultimately more satisfying than the teary-eyed [[oKriginal]] . ",0.1882207989692688,0.5203224420547485,1,0,1,325,"Successful"
"this is a shameless sham , calculated to [[cash]] in on the popularity of its stars . ","this is a shameless sham , calculated to [[caQsh]] in on the popularity of its stars . ",0.435762882232666,0.5788772106170654,0,1,0,232,"Successful"
"if you 've ever entertained the notion of doing what the title of this film implies , what sex with strangers actually shows may put you off the [[idea]] forever . ","if you 've ever entertained the notion of doing what the title of this film implies , what sex with strangers actually shows may put you off the [[ida]] forever . ",0.3289108872413635,0.5073091387748718,0,1,0,358,"Successful"
"once the 50 year old benigni appears as the title character , we find ourselves longing for the block of wood to come [[back]] . ","once the 50 year old benigni appears as the title character , we find ourselves longing for the block of wood to come [[bck]] . ",0.13774722814559937,0.537662148475647,0,1,0,273,"Successful"
"[[stultifyingly]] , dumbfoundingly , mind-numbingly bad . ","[[sPtultifyingly]] , dumbfoundingly , mind-numbingly bad . ",0.1860557198524475,0.18605583906173706,0,0,0,270,"Failed"
"an effectively creepy , fear-inducing ( not fear-reducing ) film from [[japanese]] director hideo nakata , who takes the superstitious curse on chain letters and actually applies it . ","an effectively creepy , fear-inducing ( not fear-reducing ) film from [[jYapanese]] director hideo nakata , who takes the superstitious curse on chain letters and actually applies it . ",0.1903170347213745,0.41679829359054565,1,1,1,689,"Failed"
"sustains its dreamlike glide through a succession of [[cheesy]] coincidences and voluptuous cheap effects , not the least of which is rebecca romijn-stamos . ","sustains its dreamlike glide through a succession of [[chessy]] coincidences and voluptuous cheap effects , not the least of which is rebecca romijn-stamos . ",0.47597736120224,0.8783875107765198,0,1,0,555,"Successful"
"because of an unnecessary and clumsy last scene , ` swimfan ' left me with a very bad feeling . ","because of an unnecessary and clumsy last scene , ` swimfan ' left me with a very bad feeling . ",0.6461168527603149,0.6461168527603149,1,1,0,1,"Skipped"
"no aspirations to social [[import]] inform the movie version . ","no aspirations to social [[iYmport]] inform the movie version . ",0.006227672100067139,0.011653125286102295,0,0,0,215,"Failed"
"sit through this one , and you wo n't need a magic watch to stop time ; your dvd player will do it for you . ","sit through this one , and you wo n't need a magic watch to stop time ; your dvd player will do it for you . ",0.9779700040817261,0.9779700040817261,1,1,0,1,"Skipped"
"for the first time in years , de niro digs deep [[emotionally]] , perhaps because he 's been stirred by the powerful work of his co-stars . ","for the first time in years , de niro digs deep [[eOmotionally]] , perhaps because he 's been stirred by the powerful work of his co-stars . ",0.01930546760559082,0.060582756996154785,1,1,1,349,"Failed"
"not since tom cruise in risky business has an actor made such a strong [[impression]] in his underwear . ","not since tom cruise in risky business has an actor made such a strong [[iWmpression]] in his underwear . ",0.19249820709228516,0.3958320617675781,1,1,1,313,"Failed"
"an [[interesting]] story with a pertinent ( cinematically unique ) message , told fairly well and scored to perfection , i found myself struggling to put my finger on that elusive `` missing thing . '' ","an [[ibteresting]] story with a pertinent ( cinematically unique ) message , told fairly well and scored to perfection , i found myself struggling to put my finger on that elusive `` missing thing . '' ",0.24789512157440186,0.6886071562767029,1,0,1,665,"Successful"
"... routine , harmless diversion and little else . ","... routine , harmless diversion and little else . ",0.7095633745193481,0.7095633745193481,0,0,1,1,"Skipped"
"is the time really ripe for a warmed-over james bond adventure , with a village [[idiot]] as the 007 clone ? ","is the time really ripe for a warmed-over james bond adventure , with a village [[idit]] as the 007 clone ? ",0.47224366664886475,0.6249029636383057,0,1,0,287,"Successful"
"even the finest chef ca n't make a hotdog into anything more than a hotdog , and robert de niro ca n't [[make]] this movie anything more than a trashy cop buddy comedy . ","even the finest chef ca n't make a hotdog into anything more than a hotdog , and robert de niro ca n't [[mae]] this movie anything more than a trashy cop buddy comedy . ",0.033384740352630615,0.05337554216384888,0,0,0,407,"Failed"
"the reality of the new live-action pinocchio he directed , cowrote and starred in borders on the grotesque . ","the reality of the new live-action pinocchio he directed , cowrote and starred in borders on the grotesque . ",0.5703568458557129,0.5703568458557129,1,1,0,1,"Skipped"
"samira makhmalbaf 's new film blackboards is much like the ethos of a stream of consciousness , although , it 's unfortunate for the viewer that the thoughts and reflections coming through are torpid and banal ","samira makhmalbaf 's new film blackboards is much like the ethos of a stream of consciousness , although , it 's unfortunate for the viewer that the thoughts and reflections coming through are torpid and banal ",0.9028863906860352,0.9028863906860352,1,1,0,1,"Skipped"
"a bloated gasbag thesis grotesquely impressed by its own gargantuan aura of self-importance ... ","a bloated gasbag thesis grotesquely impressed by its own gargantuan aura of self-importance ... ",0.542968213558197,0.542968213558197,1,1,0,1,"Skipped"
"every time you look , sweet home alabama is taking [[another]] bummer of a wrong turn . ","every time you look , sweet home alabama is taking [[anther]] bummer of a wrong turn . ",0.14166021347045898,0.5615494251251221,0,1,0,246,"Successful"
"how do you spell [[cliché]] ? ","how do you spell [[ciché]] ? ",0.4335365295410156,0.6472567915916443,0,1,0,51,"Successful"
"no telegraphing is too obvious or simplistic for this [[movie]] . ","no telegraphing is too obvious or simplistic for this [[move]] . ",0.0007658004760742188,0.001277148723602295,0,0,0,195,"Failed"
"director of [[photography]] benoit delhomme shot the movie in delicious colors , and the costumes and sets are grand . ","director of [[pbotography]] benoit delhomme shot the movie in delicious colors , and the costumes and sets are grand . ",0.36046189069747925,0.5040580034255981,1,0,1,388,"Successful"
"i thought my own watch had stopped keeping [[time]] as i slogged my way through clockstoppers . ","i thought my own watch had stopped keeping [[tine]] as i slogged my way through clockstoppers . ",0.020723819732666016,0.03997117280960083,0,0,0,260,"Failed"
"less dizzying than just dizzy , the jaunt is practically over before it [[begins]] . ","less dizzying than just dizzy , the jaunt is practically over before it [[bevins]] . ",0.22514671087265015,0.3215157985687256,0,0,0,194,"Failed"
"overall the film feels [[like]] a low-budget tv pilot that could not find a buyer to play it on the tube . ","overall the film feels [[lie]] a low-budget tv pilot that could not find a buyer to play it on the tube . ",0.05206573009490967,0.09641444683074951,0,0,0,255,"Failed"
"they should have [[called]] it gutterball . ","they should have [[cBalled]] it gutterball . ",0.3164673447608948,0.3437226414680481,0,0,0,87,"Failed"
"corpus collosum -- while undeniably interesting -- wore out its welcome well before the end credits rolled about 45 minutes in . ","corpus collosum -- while undeniably interesting -- wore out its welcome well before the end credits rolled about 45 minutes in . ",0.7552804946899414,0.7552804946899414,1,1,0,1,"Skipped"
"( a ) n utterly [[charming]] and hilarious film that reminded me of the best of the disney comedies from the 60s . ","( a ) n utterly [[cahrming]] and hilarious film that reminded me of the best of the disney comedies from the 60s . ",0.024939656257629395,0.527063250541687,1,0,1,291,"Successful"
"there 's too much falseness to the second half , and what began as an intriguing look at youth fizzles into a [[dull]] , ridiculous attempt at heart-tugging . ","there 's too much falseness to the second half , and what began as an intriguing look at youth fizzles into a [[dul]] , ridiculous attempt at heart-tugging . ",0.06500619649887085,0.3787163496017456,0,0,0,458,"Failed"
"wince-inducing dialogue , thrift-shop costumes , prosthetic makeup by silly putty and kmart blue-light-special effects all conspire to test trekkie loyalty . ","wince-inducing dialogue , thrift-shop costumes , prosthetic makeup by silly putty and kmart blue-light-special effects all conspire to test trekkie loyalty . ",0.7661831974983215,0.7661831974983215,1,1,0,1,"Skipped"
"a rigorously structured and exquisitely filmed drama about a father and son connection that is a brief shooting [[star]] of love . ","a rigorously structured and exquisitely filmed drama about a father and son connection that is a brief shooting [[sXtar]] of love . ",0.00021272897720336914,0.003980457782745361,1,1,1,429,"Failed"
"this is [[human]] comedy at its most amusing , interesting and confirming . ","this is [[hunan]] comedy at its most amusing , interesting and confirming . ",0.053367555141448975,0.6835554242134094,1,0,1,221,"Successful"
"whaley 's determination to immerse you in sheer , unrelenting wretchedness is exhausting . ","whaley 's determination to immerse you in sheer , unrelenting wretchedness is exhausting . ",0.7137704491615295,0.7137704491615295,1,1,0,1,"Skipped"
"[[worth]] watching for dong jie 's performance -- and for the way it documents a culture in the throes of rapid change . ","[[wkrth]] watching for dong jie 's performance -- and for the way it documents a culture in the throes of rapid change . ",0.012303173542022705,0.06846898794174194,1,1,1,325,"Failed"
"a poignant , artfully crafted [[meditation]] on mortality . ","a poignant , artfully crafted [[mKeditation]] on mortality . ",0.008276402950286865,0.49031007289886475,1,1,1,250,"Failed"
"too restrained to be a freak show , too mercenary and obvious to be cerebral , too [[dull]] and pretentious to be engaging ... the isle defies an easy categorization . ","too restrained to be a freak show , too mercenary and obvious to be cerebral , too [[dul]] and pretentious to be engaging ... the isle defies an easy categorization . ",0.2918156385421753,0.5331656336784363,0,1,0,530,"Successful"
"vera 's three actors -- mollà , gil and bardem -- [[excel]] in insightful , empathetic performances . ","vera 's three actors -- mollà , gil and bardem -- [[exel]] in insightful , empathetic performances . ",0.030857324600219727,0.10366553068161011,1,1,1,348,"Failed"
"it 's everything you do n't go to the [[movies]] for . ","it 's everything you do n't go to the [[moves]] for . ",0.1707308292388916,0.22898483276367188,0,0,0,93,"Failed"
"( grant 's ) bumbling magic takes over the film , and it turns out to be another winning [[star]] vehicle . ","( grant 's ) bumbling magic takes over the film , and it turns out to be another winning [[sOtar]] vehicle . ",0.33969253301620483,0.8414940237998962,1,0,1,277,"Successful"
"it gets onto the screen just about as much of the novella as one could reasonably expect , and is engrossing and moving in its own [[right]] . ","it gets onto the screen just about as much of the novella as one could reasonably expect , and is engrossing and moving in its own [[rght]] . ",0.13604402542114258,0.28733551502227783,1,1,1,332,"Failed"
"velocity represents everything [[wrong]] with '' independent film '' as a commodified , sold-out concept on the american filmmaking scene . ","velocity represents everything [[weong]] with '' independent film '' as a commodified , sold-out concept on the american filmmaking scene . ",0.4194914698600769,0.6242812871932983,0,1,0,535,"Successful"
"but taken as a [[stylish]] and energetic one-shot , the queen of the damned can not be said to suck . ","but taken as a [[sfylish]] and energetic one-shot , the queen of the damned can not be said to suck . ",0.028414368629455566,0.7011547684669495,1,0,1,243,"Successful"
"the piece plays as well as it does thanks in [[large]] measure to anspaugh 's three lead actresses . ","the piece plays as well as it does thanks in [[lage]] measure to anspaugh 's three lead actresses . ",0.49746954441070557,0.6207937002182007,1,0,1,301,"Successful"
"suffocated by its fussy script and uptight characters , this musty adaptation is all the more annoying since it 's been packaged and sold [[back]] to us by hollywood . ","suffocated by its fussy script and uptight characters , this musty adaptation is all the more annoying since it 's been packaged and sold [[bck]] to us by hollywood . ",0.17570185661315918,0.42517292499542236,0,0,0,490,"Failed"
"but what are adults doing in the [[theater]] at all ? ","but what are adults doing in the [[thater]] at all ? ",0.07016104459762573,0.21413201093673706,0,0,0,74,"Failed"
"like being trapped at a perpetual frat party ... how can something so gross be so [[boring]] ? ","like being trapped at a perpetual frat party ... how can something so gross be so [[bring]] ? ",0.003174304962158203,0.03296273946762085,0,0,0,244,"Failed"
