"original_text","perturbed_text","original_score","perturbed_score","original_output","perturbed_output","ground_truth_output","num_queries","result_type"
"` de [[niro]] ... is a veritable source of sincere passion that this hollywood contrivance orbits around . ' ","` de [[nio]] ... is a veritable source of sincere passion that this hollywood contrivance orbits around . ' ",0.0170862078666687,0.033802688121795654,1,1,1,346,"Failed"
"a misogynistic piece of filth that attempts to pass itself off as hip , young [[adult]] entertainment . ","a misogynistic piece of filth that attempts to pass itself off as hip , young [[ault]] entertainment . ",0.14158904552459717,0.2494419813156128,0,0,0,312,"Failed"
"its story may be a thousand years old , but why did it have to seem like it took [[another]] thousand to tell it to us ? ","its story may be a thousand years old , but why did it have to seem like it took [[anther]] thousand to tell it to us ? ",0.047236502170562744,0.19481408596038818,0,0,0,237,"Failed"
"try as i may , i ca n't think of a single good reason to see this movie , even though everyone in my group extemporaneously shouted , ` thank you ! ' ","try as i may , i ca n't think of a single good reason to see this movie , even though everyone in my group extemporaneously shouted , ` thank you ! ' ",0.8589191436767578,0.8589191436767578,1,1,0,1,"Skipped"
"the movie is beautiful to behold and engages one in a sense of epic struggle -- inner and outer -- that 's all too rare in [[hollywood]] 's hastier productions . ","the movie is beautiful to behold and engages one in a sense of epic struggle -- inner and outer -- that 's all too rare in [[hFollywood]] 's hastier productions . ",0.08976572751998901,0.2771199941635132,1,1,1,449,"Failed"
"a celebration of [[quirkiness]] , eccentricity , and certain individuals ' tendency to let it all hang out , and damn the consequences . ","a celebration of [[qSuirkiness]] , eccentricity , and certain individuals ' tendency to let it all hang out , and damn the consequences . ",0.0005219578742980957,0.03104621171951294,1,1,1,466,"Failed"
"[[morton]] uses her face and her body language to bring us morvern 's soul , even though the character is almost completely deadpan . ","[[moron]] uses her face and her body language to bring us morvern 's soul , even though the character is almost completely deadpan . ",0.34074127674102783,0.5917051434516907,1,0,1,426,"Successful"
"instead of a hyperbolic beat-charged urban western , it 's an unpretentious , sociologically pointed [[slice]] of life . ","instead of a hyperbolic beat-charged urban western , it 's an unpretentious , sociologically pointed [[slide]] of life . ",0.04250836372375488,0.13000595569610596,1,1,1,481,"Failed"
"my thoughts were focused on the characters . ","my thoughts were focused on the characters . ",0.9496545195579529,0.9496545195579529,0,0,1,1,"Skipped"
"so , too , is this comedy about mild [[culture]] clashing in today 's new delhi . ","so , too , is this comedy about mild [[chlture]] clashing in today 's new delhi . ",0.20911729335784912,0.3251732587814331,1,1,1,180,"Failed"
"for starters , the story is just too [[slim]] . ","for starters , the story is just too [[sim]] . ",0.025320768356323242,0.11948949098587036,0,0,0,84,"Failed"
"this is a [[winning]] ensemble comedy that shows canadians can put gentle laughs and equally gentle sentiments on the button , just as easily as their counterparts anywhere else in the world . ","this is a [[wUinning]] ensemble comedy that shows canadians can put gentle laughs and equally gentle sentiments on the button , just as easily as their counterparts anywhere else in the world . ",0.0009069442749023438,0.033395349979400635,1,1,1,592,"Failed"
"at the very least , if you do n't know anything about derrida when you walk into the theater , you wo n't know [[much]] more when you leave . ","at the very least , if you do n't know anything about derrida when you walk into the theater , you wo n't know [[mich]] more when you leave . ",0.3985455632209778,0.49040740728378296,0,0,0,229,"Failed"
"the [[format]] gets used best ... to capture the dizzying heights achieved by motocross and bmx riders , whose balletic hotdogging occasionally ends in bone-crushing screwups . ","the [[frmat]] gets used best ... to capture the dizzying heights achieved by motocross and bmx riders , whose balletic hotdogging occasionally ends in bone-crushing screwups . ",0.053793251514434814,0.11254066228866577,1,1,1,675,"Failed"
"inside the film 's conflict-powered plot there is a decent moral trying to get out , but it 's not that , it 's the tension that keeps you in your [[seat]] . ","inside the film 's conflict-powered plot there is a decent moral trying to get out , but it 's not that , it 's the tension that keeps you in your [[sdat]] . ",0.19415664672851562,0.3460986614227295,1,1,1,315,"Failed"
"there ought to be a directing license , so that ed [[burns]] can have his revoked . ","there ought to be a directing license , so that ed [[bruns]] can have his revoked . ",0.22802913188934326,0.42301082611083984,0,0,0,180,"Failed"
"bad . ","bad . ",0.06929963827133179,0.06929963827133179,0,0,0,1,"Failed"
"that dogged [[good]] will of the parents and ` vain ' jia 's defoliation of ego , make the film touching despite some doldrums . ","that dogged [[gSood]] will of the parents and ` vain ' jia 's defoliation of ego , make the film touching despite some doldrums . ",0.10991108417510986,0.5711416006088257,1,0,1,326,"Successful"
"falls neatly into the category of good stupid fun . ","falls neatly into the category of good stupid fun . ",0.8370650410652161,0.8370650410652161,0,0,1,1,"Skipped"
"an [[artful]] , intelligent film that stays within the confines of a well-established genre . ","an [[aWrtful]] , intelligent film that stays within the confines of a well-established genre . ",0.0036267638206481934,0.0633118748664856,1,1,1,345,"Failed"
"[[smart]] , provocative and blisteringly funny . ","[[sart]] , provocative and blisteringly funny . ",0.00206911563873291,0.12716788053512573,1,1,1,187,"Failed"
"and the lesson , in the end , is [[nothing]] new . ","and the lesson , in the end , is [[notching]] new . ",0.45429831743240356,0.8681651949882507,0,1,0,72,"Successful"
"this is not the undisputed worst boxing movie ever , but it 's certainly not a champion - the big [[loser]] is the audience . ","this is not the undisputed worst boxing movie ever , but it 's certainly not a champion - the big [[loder]] is the audience . ",0.023003995418548584,0.03997325897216797,0,0,0,318,"Failed"
"not only is undercover brother as funny , if not more so , than both austin powers films , but it 's also one of the smarter , savvier spoofs to come along in some time . ","not only is undercover brother as funny , if not more so , than both austin powers films , but it 's also one of the smarter , savvier spoofs to come along in some time . ",0.7929980158805847,0.7929980158805847,0,0,1,1,"Skipped"
"to say this was done better in wilder 's some like it hot is like saying the sun rises in the east . ","to say this was done better in wilder 's some like it hot is like saying the sun rises in the east . ",0.9598456621170044,0.9598456621170044,1,1,0,1,"Skipped"
"the entire movie is about a boring , sad man being [[boring]] and sad . ","the entire movie is about a boring , sad man being [[bring]] and sad . ",0.07822191715240479,0.6930387020111084,0,1,0,110,"Successful"
"this time mr. burns is trying something in the martin scorsese street-realist mode , but his self-regarding sentimentality trips him up again . ","this time mr. burns is trying something in the martin scorsese street-realist mode , but his self-regarding sentimentality trips him up again . ",0.9652770161628723,0.9652770161628723,1,1,0,1,"Skipped"
"perceptive in its vision of nascent industrialized world politics as a new art form , but far too [[clunky]] , didactic and saddled with scenes that seem simply an ill fit for this movie . ","perceptive in its vision of nascent industrialized world politics as a new art form , but far too [[cluny]] , didactic and saddled with scenes that seem simply an ill fit for this movie . ",0.4021459221839905,0.6418570876121521,0,1,0,510,"Successful"
"the best revenge may just be living well because this film , unlike other dumas adaptations , is far more likened to a treasure than a lengthy jail sentence . ","the best revenge may just be living well because this film , unlike other dumas adaptations , is far more likened to a treasure than a lengthy jail sentence . ",0.583599865436554,0.583599865436554,0,0,1,1,"Skipped"
"the movie understands like few [[others]] how the depth and breadth of emotional intimacy give the physical act all of its meaning and most of its pleasure . ","the movie understands like few [[oCthers]] how the depth and breadth of emotional intimacy give the physical act all of its meaning and most of its pleasure . ",0.2743288278579712,0.5145038366317749,1,0,1,449,"Successful"
"once ( kim ) begins to overplay the shock tactics and bait-and-tackle metaphors , you may decide it 's too high a price to pay for a shimmering picture [[postcard]] . ","once ( kim ) begins to overplay the shock tactics and bait-and-tackle metaphors , you may decide it 's too high a price to pay for a shimmering picture [[pMostcard]] . ",0.1814306378364563,0.3634623885154724,0,0,0,495,"Failed"
"all that 's missing is the spontaneity , originality and delight . ","all that 's missing is the spontaneity , originality and delight . ",0.8550284504890442,0.8550284504890442,1,1,0,1,"Skipped"
"what the film lacks in general focus it makes up for in compassion , as corcuera manages to find the seeds of hope in the [[form]] of collective action . ","what the film lacks in general focus it makes up for in compassion , as corcuera manages to find the seeds of hope in the [[fom]] of collective action . ",0.038747429847717285,0.06703275442123413,1,1,1,411,"Failed"
"the socio-histo-political treatise is told in earnest strides ... ( and ) personal illusion is deconstructed with [[poignancy]] . ","the socio-histo-political treatise is told in earnest strides ... ( and ) personal illusion is deconstructed with [[pignancy]] . ",0.06026649475097656,0.21964722871780396,1,1,1,508,"Failed"
"my reaction in a [[word]] : disappointment . ","my reaction in a [[wolrd]] : disappointment . ",0.018403053283691406,0.02782505750656128,0,0,0,144,"Failed"
"a psychological thriller with a genuinely spooky premise and an above-average cast , actor bill paxton 's directing debut is a creepy [[slice]] of gothic rural americana . ","a psychological thriller with a genuinely spooky premise and an above-average cast , actor bill paxton 's directing debut is a creepy [[slide]] of gothic rural americana . ",0.019482672214508057,0.09045666456222534,1,1,1,638,"Failed"
"corny , schmaltzy and predictable , but still manages to be kind of heartwarming , nonetheless . ","corny , schmaltzy and predictable , but still manages to be kind of heartwarming , nonetheless . ",0.8597880601882935,0.8597880601882935,0,0,1,1,"Skipped"
"nothing 's at stake , just a twisty double-cross you can smell a mile away -- still , the derivative [[nine]] queens is lots of fun . ","nothing 's at stake , just a twisty double-cross you can smell a mile away -- still , the derivative [[none]] queens is lots of fun . ",0.4254310131072998,0.8368042707443237,1,0,1,356,"Successful"
"far more [[imaginative]] and ambitious than the trivial , cash-in features nickelodeon has made from its other animated tv series . ","far more [[iGmaginative]] and ambitious than the trivial , cash-in features nickelodeon has made from its other animated tv series . ",0.030288219451904297,0.3630562424659729,1,1,1,406,"Failed"
"of course , by more objective measurements it 's still [[quite]] bad . ","of course , by more objective measurements it 's still [[quire]] bad . ",0.4599919319152832,0.47490179538726807,0,0,0,210,"Failed"
"as the two leads , lathan and diggs are [[charming]] and have chemistry both as friends and lovers . ","as the two leads , lathan and diggs are [[charing]] and have chemistry both as friends and lovers . ",0.0005754232406616211,0.20346182584762573,1,1,1,256,"Failed"
"it provides an [[honest]] look at a community striving to anchor itself in new grounds . ","it provides an [[hinest]] look at a community striving to anchor itself in new grounds . ",0.02481710910797119,0.30217933654785156,1,1,1,251,"Failed"
"this movie seems to have been written [[using]] mad-libs . ","this movie seems to have been written [[uAsing]] mad-libs . ",0.18047362565994263,0.2532544732093811,0,0,0,144,"Failed"
"reign of fire looks as if it was made without much thought -- and is [[best]] watched that way . ","reign of fire looks as if it was made without much thought -- and is [[brst]] watched that way . ",0.07683819532394409,0.20483916997909546,1,1,1,233,"Failed"
"martin and barbara are complex characters -- sometimes tender , sometimes angry -- and the delicate performances by sven wollter and viveka seldahl make their [[hopes]] and frustrations vivid . ","martin and barbara are complex characters -- sometimes tender , sometimes angry -- and the delicate performances by sven wollter and viveka seldahl make their [[holes]] and frustrations vivid . ",0.04751056432723999,0.2552151083946228,1,1,1,700,"Failed"
"it 's not that [[kung]] pow is n't funny some of the time -- it just is n't any funnier than bad martial arts movies are all by themselves , without all oedekerk 's impish augmentation . ","it 's not that [[king]] pow is n't funny some of the time -- it just is n't any funnier than bad martial arts movies are all by themselves , without all oedekerk 's impish augmentation . ",0.25188833475112915,0.2950894832611084,0,0,0,360,"Failed"
"i 'd have to say the star and director are the big problems here . ","i 'd have to say the star and director are the big problems here . ",0.9993804693222046,0.9993804693222046,1,1,0,1,"Skipped"
"affleck and jackson are [[good]] sparring partners . ","affleck and jackson are [[gRood]] sparring partners . ",0.14657890796661377,0.5882010459899902,1,0,1,178,"Successful"
"whether you like rap music or loathe it , you ca n't deny either the tragic loss of two young men in the prime of their talent or the power of this movie . ","whether you like rap music or loathe it , you ca n't deny either the tragic loss of two young men in the prime of their talent or the power of this movie . ",0.6778270602226257,0.6778270602226257,0,0,1,1,"Skipped"
"not since [[japanese]] filmmaker akira kurosawa 's ran have the savagery of combat and the specter of death been visualized with such operatic grandeur . ","not since [[jBapanese]] filmmaker akira kurosawa 's ran have the savagery of combat and the specter of death been visualized with such operatic grandeur . ",0.25468116998672485,0.49914854764938354,1,1,1,475,"Failed"
"a by-the-numbers effort that wo n't do [[much]] to enhance the franchise . ","a by-the-numbers effort that wo n't do [[mich]] to enhance the franchise . ",0.14924979209899902,0.33774489164352417,0,0,0,225,"Failed"
"an occasionally funny , but overall limp , fish-out-of-water story . ","an occasionally funny , but overall limp , fish-out-of-water story . ",0.9599418044090271,0.9599418044090271,1,1,0,1,"Skipped"
"[[brilliantly]] explores the conflict between following one 's heart and following the demands of tradition . ","[[bLrilliantly]] explores the conflict between following one 's heart and following the demands of tradition . ",0.04049772024154663,0.3710179328918457,1,1,1,365,"Failed"
"despite the 2-d animation , the wild thornberrys movie makes for a surprisingly cinematic experience . ","despite the 2-d animation , the wild thornberrys movie makes for a surprisingly cinematic experience . ",0.8589648008346558,0.8589648008346558,0,0,1,1,"Skipped"
"it appears that something has been [[lost]] in the translation to the screen . ","it appears that something has been [[lst]] in the translation to the screen . ",0.0955052375793457,0.506011962890625,0,1,0,199,"Successful"
"it all feels like a [[monty]] python sketch gone horribly wrong . ","it all feels like a [[mony]] python sketch gone horribly wrong . ",0.05701601505279541,0.3748612403869629,0,0,0,197,"Failed"
"the film tunes into a grief that [[could]] lead a man across centuries . ","the film tunes into a grief that [[cold]] lead a man across centuries . ",0.347609281539917,0.6923345327377319,1,0,1,181,"Successful"
"dazzles with its fully-written characters , its determined stylishness ( which always relates to characters and story ) and johnny dankworth 's best soundtrack in years . ","dazzles with its fully-written characters , its determined stylishness ( which always relates to characters and story ) and johnny dankworth 's best soundtrack in years . ",0.6623635292053223,0.6623635292053223,0,0,1,1,"Skipped"
"it 's a work by an artist so in control of both his medium and his message that he can improvise [[like]] a jazzman . ","it 's a work by an artist so in control of both his medium and his message that he can improvise [[luke]] a jazzman . ",0.019712984561920166,0.03181910514831543,1,1,1,257,"Failed"
"it 's the chemistry between the women and the [[droll]] scene-stealing wit and wolfish pessimism of anna chancellor that makes this `` two weddings and a funeral '' fun . ","it 's the chemistry between the women and the [[ddoll]] scene-stealing wit and wolfish pessimism of anna chancellor that makes this `` two weddings and a funeral '' fun . ",0.1411036252975464,0.216894268989563,1,1,1,466,"Failed"
"stealing harvard is evidence that the farrelly bros. -- peter and bobby -- and their brand of screen comedy are wheezing to an end , along with green 's half-hearted movie [[career]] . ","stealing harvard is evidence that the farrelly bros. -- peter and bobby -- and their brand of screen comedy are wheezing to an end , along with green 's half-hearted movie [[carer]] . ",0.44016748666763306,0.6874818205833435,0,1,0,518,"Successful"
"a full world has been presented onscreen , not some series of carefully structured plot points building to a pat resolution . ","a full world has been presented onscreen , not some series of carefully structured plot points building to a pat resolution . ",0.606830358505249,0.606830358505249,0,0,1,1,"Skipped"
"huston nails both the glad-handing and the choking sense of hollow despair . ","huston nails both the glad-handing and the choking sense of hollow despair . ",0.7001399993896484,0.7001399993896484,0,0,1,1,"Skipped"
"one of the more intelligent children 's movies to hit theaters this [[year]] . ","one of the more intelligent children 's movies to hit theaters this [[yaer]] . ",0.3445214033126831,0.5410633683204651,1,0,1,211,"Successful"
"the film tries too hard to be [[funny]] and tries too hard to be hip . ","the film tries too hard to be [[finny]] and tries too hard to be hip . ",0.021846890449523926,0.060596764087677,0,0,0,110,"Failed"
"blanchett 's [[performance]] confirms her power once again . ","blanchett 's [[pdrformance]] confirms her power once again . ",0.005587279796600342,0.19207054376602173,1,1,1,190,"Failed"
"if you believe any of this , i can make you a real deal on leftover enron stock that will double in value a week from friday . ","if you believe any of this , i can make you a real deal on leftover enron stock that will double in value a week from friday . ",0.6300821304321289,0.6300821304321289,1,1,0,1,"Skipped"
"attempts by this ensemble film to impart a message are so [[heavy-handed]] that they instead pummel the audience . ","attempts by this ensemble film to impart a message are so [[haevy-handed]] that they instead pummel the audience . ",0.011557519435882568,0.576437771320343,0,1,0,356,"Successful"
"no one but a convict guilty of some truly heinous [[crime]] should have to sit through the master of disguise . ","no one but a convict guilty of some truly heinous [[crome]] should have to sit through the master of disguise . ",0.002970576286315918,0.006026566028594971,0,0,0,232,"Failed"
"rarely has so much [[money]] delivered so little entertainment . ","rarely has so much [[mony]] delivered so little entertainment . ",0.31150782108306885,0.6148757934570312,0,1,0,229,"Successful"
"taylor appears to have blown his entire budget on soundtrack rights and had [[nothing]] left over for jokes . ","taylor appears to have blown his entire budget on soundtrack rights and had [[notting]] left over for jokes . ",0.003114759922027588,0.020357847213745117,0,0,0,323,"Failed"
"`` the time machine '' is a movie that has no [[interest]] in itself . ","`` the time machine '' is a movie that has no [[interst]] in itself . ",0.05396580696105957,0.09045255184173584,0,0,0,122,"Failed"
"a rarity among recent [[iranian]] films : it 's a comedy full of gentle humor that chides the absurdity of its protagonist 's plight . ","a rarity among recent [[ianian]] films : it 's a comedy full of gentle humor that chides the absurdity of its protagonist 's plight . ",0.3978527784347534,0.8477432727813721,1,0,1,430,"Successful"
"/ but daphne , you 're too buff / fred thinks he 's tough / and velma - wow , you 've lost weight ! ","/ but daphne , you 're too buff / fred thinks he 's tough / and velma - wow , you 've lost weight ! ",0.9777279496192932,0.9777279496192932,1,1,0,1,"Skipped"
"the very definition of the ` small ' movie , but it is a good stepping stone for director sprecher . ","the very definition of the ` small ' movie , but it is a good stepping stone for director sprecher . ",0.5333904027938843,0.5333904027938843,0,0,1,1,"Skipped"
"it 's [[like]] every bad idea that 's ever gone into an after-school special compiled in one place , minus those daytime programs ' slickness and sophistication ( and who knew they even had any ? ) . ","it 's [[lie]] every bad idea that 's ever gone into an after-school special compiled in one place , minus those daytime programs ' slickness and sophistication ( and who knew they even had any ? ) . ",0.05020838975906372,0.09136050939559937,0,0,0,535,"Failed"
"chilling , well-acted , and [[finely]] directed : david jacobson 's dahmer . ","chilling , well-acted , and [[fKinely]] directed : david jacobson 's dahmer . ",0.469987154006958,0.9425092935562134,1,0,1,271,"Successful"
"it ca n't decide if it wants to be a mystery/thriller , a romance or a [[comedy]] . ","it ca n't decide if it wants to be a mystery/thriller , a romance or a [[comey]] . ",0.0779220461845398,0.09632307291030884,0,0,0,205,"Failed"
"paid in full is so stale , in fact , that its most vibrant scene is one that uses clips from brian de palma 's scarface . ","paid in full is so stale , in fact , that its most vibrant scene is one that uses clips from brian de palma 's scarface . ",0.954905092716217,0.954905092716217,1,1,0,1,"Skipped"
"a coda in every sense , the pinochet case splits time between a minute-by-minute account of the british court 's extradition chess game and the regime 's talking-head survivors . ","a coda in every sense , the pinochet case splits time between a minute-by-minute account of the british court 's extradition chess game and the regime 's talking-head survivors . ",0.6266615390777588,0.6266615390777588,0,0,1,1,"Skipped"
"it 's played in the most straight-faced fashion , with little humor to lighten things up . ","it 's played in the most straight-faced fashion , with little humor to lighten things up . ",0.827674925327301,0.827674925327301,1,1,0,1,"Skipped"
"a [[dumb]] movie with dumb characters doing dumb things and you have to be really dumb not to see where this is going . ","a [[dmb]] movie with dumb characters doing dumb things and you have to be really dumb not to see where this is going . ",0.024434149265289307,0.047159790992736816,0,0,0,220,"Failed"
"with virtually no interesting elements for an audience to focus on , chelsea [[walls]] is a triple-espresso endurance challenge . ","with virtually no interesting elements for an audience to focus on , chelsea [[walis]] is a triple-espresso endurance challenge . ",0.01194983720779419,0.03199160099029541,0,0,0,498,"Failed"
"dense with characters and contains some [[thrilling]] moments . ","dense with characters and contains some [[tOhrilling]] moments . ",0.06784552335739136,0.34836554527282715,1,1,1,220,"Failed"
"as unseemly as its title suggests . ","as unseemly as its title suggests . ",0.8457677364349365,0.8457677364349365,0,0,1,1,"Skipped"
"it 's [[like]] watching a nightmare made flesh . ","it 's [[lie]] watching a nightmare made flesh . ",0.38352155685424805,0.7942890524864197,0,1,0,162,"Successful"
"[[minority]] report is exactly what the title indicates , a report . ","[[mdinority]] report is exactly what the title indicates , a report . ",0.005354404449462891,0.22569036483764648,1,1,1,213,"Failed"
"it 's hard to like a film about a guy who is utterly unlikeable , and shiner , starring michael caine as an aging british boxing promoter desperate for a taste of fame and fortune , is certainly that . ","it 's hard to like a film about a guy who is utterly unlikeable , and shiner , starring michael caine as an aging british boxing promoter desperate for a taste of fame and fortune , is certainly that . ",0.888472855091095,0.888472855091095,1,1,0,1,"Skipped"
"an entertaining , colorful , action-filled crime story with an [[intimate]] heart . ","an entertaining , colorful , action-filled crime story with an [[ibtimate]] heart . ",0.0077939629554748535,0.02854400873184204,1,1,1,310,"Failed"
"for this reason and this reason only -- the power of its own steadfast , hoity-toity convictions -- chelsea walls deserves a medal . ","for this reason and this reason only -- the power of its own steadfast , hoity-toity convictions -- chelsea walls deserves a medal . ",0.7861922979354858,0.7861922979354858,0,0,1,1,"Skipped"
