"original_text","perturbed_text","original_score","perturbed_score","original_output","perturbed_output","ground_truth_output","num_queries","result_type"
"partway through watching this saccharine , easter-egg-colored concoction , you realize that it is made up of three episodes of a rejected tv show . ","partway through watching this saccharine , easter-egg-colored concoction , you realize that it is made up of three episodes of a rejected tv show . ",0.8295634388923645,0.8295634388923645,1,1,0,1,"Skipped"
"for the most part , it 's a work of incendiary [[genius]] , steering clear of knee-jerk reactions and quick solutions . ","for the most part , it 's a work of incendiary [[genis]] , steering clear of knee-jerk reactions and quick solutions . ",0.0818825364112854,0.11964637041091919,1,1,1,362,"Failed"
"the special effects and many scenes of weightlessness look as good or better than in the original , while the oscar-winning sound and james horner 's rousing score make good use of the hefty audio system . ","the special effects and many scenes of weightlessness look as good or better than in the original , while the oscar-winning sound and james horner 's rousing score make good use of the hefty audio system . ",0.7164422273635864,0.7164422273635864,0,0,1,1,"Skipped"
"not since freddy got fingered has a major release been so [[painful]] to sit through . ","not since freddy got fingered has a major release been so [[pLainful]] to sit through . ",0.06466221809387207,0.09060084819793701,0,0,0,207,"Failed"
"the movie is what happens when you [[blow]] up small potatoes to 10 times their natural size , and it ai n't pretty . ","the movie is what happens when you [[bow]] up small potatoes to 10 times their natural size , and it ai n't pretty . ",0.47236692905426025,0.6786673069000244,0,1,0,232,"Successful"
"we have n't [[seen]] such hilarity since say it is n't so ! ","we have n't [[sZeen]] such hilarity since say it is n't so ! ",0.20809686183929443,0.27330178022384644,1,1,1,81,"Failed"
"to [[call]] the other side of heaven `` appalling '' would be to underestimate just how dangerous entertainments like it can be . ","to [[cail]] the other side of heaven `` appalling '' would be to underestimate just how dangerous entertainments like it can be . ",0.3786565065383911,0.476559042930603,0,0,0,374,"Failed"
"[[nothing]] is sacred in this gut-buster . ","[[noting]] is sacred in this gut-buster . ",0.18516135215759277,0.7806344628334045,0,1,0,129,"Successful"
"feels haphazard , as if the writers mistakenly thought they could achieve an air of frantic spontaneity by simply tossing in lots of characters doing [[silly]] stuff and stirring the pot . ","feels haphazard , as if the writers mistakenly thought they could achieve an air of frantic spontaneity by simply tossing in lots of characters doing [[solly]] stuff and stirring the pot . ",0.09295135736465454,0.3417159914970398,0,0,0,613,"Failed"
"[[tries]] to add some spice to its quirky sentiments but the taste is all too familiar . ","[[tris]] to add some spice to its quirky sentiments but the taste is all too familiar . ",0.038855791091918945,0.06931769847869873,0,0,0,203,"Failed"
"at its worst , it [[implodes]] in a series of very bad special effects . ","at its worst , it [[implores]] in a series of very bad special effects . ",0.27566301822662354,0.3902429938316345,0,0,0,173,"Failed"
"with tightly organized efficiency , numerous flashbacks and a constant edge of tension , miller 's film is one of [[2002]] 's involvingly adult surprises . ","with tightly organized efficiency , numerous flashbacks and a constant edge of tension , miller 's film is one of [[20t02]] 's involvingly adult surprises . ",0.04538649320602417,0.4060565233230591,1,1,1,560,"Failed"
"a great ensemble [[cast]] ca n't lift this heartfelt enterprise out of the familiar . ","a great ensemble [[cat]] ca n't lift this heartfelt enterprise out of the familiar . ",0.31316685676574707,0.46945130825042725,0,0,0,263,"Failed"
"a warm but realistic [[meditation]] on friendship , family and affection . ","a warm but realistic [[mMeditation]] on friendship , family and affection . ",2.3365020751953125e-05,0.001080632209777832,1,1,1,287,"Failed"
"at times , the suspense is palpable , but by the end there 's a sense that the crux of the mystery hinges on a technicality that strains credulity and leaves the viewer [[haunted]] by the waste of potential . ","at times , the suspense is palpable , but by the end there 's a sense that the crux of the mystery hinges on a technicality that strains credulity and leaves the viewer [[hunted]] by the waste of potential . ",0.33658134937286377,0.7018264532089233,0,1,0,570,"Successful"
"while the resident evil games may have set new standards for thrills , suspense , and gore for video games , the movie really only succeeds in the third of these . ","while the resident evil games may have set new standards for thrills , suspense , and gore for video games , the movie really only succeeds in the third of these . ",0.9668813347816467,0.9668813347816467,1,1,0,1,"Skipped"
"it 's a remarkably [[solid]] and subtly satirical tour de force . ","it 's a remarkably [[silid]] and subtly satirical tour de force . ",0.00014901161193847656,0.008455991744995117,1,1,1,200,"Failed"
"director andrew niccol ... demonstrates a wry understanding of the quirks of [[fame]] . ","director andrew niccol ... demonstrates a wry understanding of the quirks of [[fEame]] . ",0.1272459626197815,0.37325793504714966,1,1,1,316,"Failed"
"when leguizamo finally plugged an irritating character [[late]] in the movie . ","when leguizamo finally plugged an irritating character [[lae]] in the movie . ",0.0025320053100585938,0.10961824655532837,0,0,0,280,"Failed"
"thekids will probably stay amused at the kaleidoscope of big , colorful characters . ","thekids will probably stay amused at the kaleidoscope of big , colorful characters . ",0.5147557854652405,0.5147557854652405,0,0,1,1,"Skipped"
"mattei is tiresomely grave and [[long-winded]] , as if circularity itself indicated profundity . ","mattei is tiresomely grave and [[longwinded]] , as if circularity itself indicated profundity . ",0.1441403031349182,0.638278067111969,0,1,0,369,"Successful"
"... plays like somebody spliced [[random]] moments of a chris rock routine into what is otherwise a cliche-riddled but self-serious spy thriller . ","... plays like somebody spliced [[radom]] moments of a chris rock routine into what is otherwise a cliche-riddled but self-serious spy thriller . ",0.015461444854736328,0.05114167928695679,0,0,0,529,"Failed"
"an overemphatic , would-be wacky , ultimately [[tedious]] sex farce . ","an overemphatic , would-be wacky , ultimately [[tLedious]] sex farce . ",0.007380306720733643,0.0256614089012146,0,0,0,261,"Failed"
"it all [[adds]] up to good fun . ","it all [[adfs]] up to good fun . ",0.0011947154998779297,0.08173155784606934,1,1,1,29,"Failed"
"whether writer-director anne fontaine 's film is a ghost story , an account of a nervous breakdown , a trip down memory lane , all three or none of the above , it is as seductive as it is haunting . ","whether writer-director anne fontaine 's film is a ghost story , an account of a nervous breakdown , a trip down memory lane , all three or none of the above , it is as seductive as it is haunting . ",0.5102477073669434,0.5102477073669434,0,0,1,1,"Skipped"
"another in-your-face wallow in the lower depths made by people who have never sung those [[blues]] . ","another in-your-face wallow in the lower depths made by people who have never sung those [[blurs]] . ",0.1183575987815857,0.3501002788543701,0,0,0,287,"Failed"
"a very [[well-made]] , funny and entertaining picture . ","a very [[wAell-made]] , funny and entertaining picture . ",0.0003618001937866211,0.08858442306518555,1,1,1,180,"Failed"
"it 's [[worth]] seeing just on the basis of the wisdom , and at times , the startling optimism , of the children . ","it 's [[wkrth]] seeing just on the basis of the wisdom , and at times , the startling optimism , of the children . ",0.05055880546569824,0.22099488973617554,1,1,1,278,"Failed"
"despite its title , punch-drunk love is never heavy-handed . ","despite its title , punch-drunk love is never heavy-handed . ",0.9960886836051941,0.9960886836051941,0,0,1,1,"Skipped"
"if director michael dowse only superficially understands his characters , he does n't hold them in contempt . ","if director michael dowse only superficially understands his characters , he does n't hold them in contempt . ",0.6053545475006104,0.6053545475006104,1,1,0,1,"Skipped"
"it 's [[refreshing]] to see a girl-power movie that does n't feel it has to prove anything . ","it 's [[rRefreshing]] to see a girl-power movie that does n't feel it has to prove anything . ",0.3496732711791992,0.8679465055465698,1,0,1,224,"Successful"
"the film may appear naked in its narrative form ... but it goes deeper than that , to fundamental choices that include the complexity of the [[catholic]] doctrine ","the film may appear naked in its narrative form ... but it goes deeper than that , to fundamental choices that include the complexity of the [[cYatholic]] doctrine ",0.14371490478515625,0.3216637372970581,1,1,1,460,"Failed"
"however it may please those who love movies that blare with pop songs , young science fiction fans will stomp away in disgust . ","however it may please those who love movies that blare with pop songs , young science fiction fans will stomp away in disgust . ",0.8751540780067444,0.8751540780067444,1,1,0,1,"Skipped"
"as vulgar as it is [[banal]] . ","as vulgar as it is [[baal]] . ",0.4693751931190491,0.6915282607078552,0,1,0,55,"Successful"
"zhang ... has done an [[amazing]] job of getting realistic performances from his mainly nonprofessional cast . ","zhang ... has done an [[aRmazing]] job of getting realistic performances from his mainly nonprofessional cast . ",0.08489680290222168,0.41201549768447876,1,1,1,385,"Failed"
"outer-space buffs might love this film , but others will find its pleasures intermittent . ","outer-space buffs might love this film , but others will find its pleasures intermittent . ",0.9934669733047485,0.9934669733047485,1,1,0,1,"Skipped"
"maud and roland 's search for an unknowable past makes for a haunting literary detective story , but labute pulls off a neater trick in possession : he [[makes]] language sexy . ","maud and roland 's search for an unknowable past makes for a haunting literary detective story , but labute pulls off a neater trick in possession : he [[maakes]] language sexy . ",0.45454198122024536,0.5382601618766785,1,0,1,596,"Successful"
"more whiny [[downer]] than corruscating commentary . ","more whiny [[doner]] than corruscating commentary . ",0.021749138832092285,0.22316396236419678,0,0,0,185,"Failed"
"there are simply too many ideas floating around -- part farce , part sliding doors , [[part]] pop video -- and yet failing to exploit them . ","there are simply too many ideas floating around -- part farce , part sliding doors , [[pat]] pop video -- and yet failing to exploit them . ",0.3855993151664734,0.7525624632835388,0,1,0,358,"Successful"
"it 's another stale , kill-by-numbers flick , complete with blade-thin characters and terrible , pun-laden dialogue . ","it 's another stale , kill-by-numbers flick , complete with blade-thin characters and terrible , pun-laden dialogue . ",0.5401394963264465,0.5401394963264465,1,1,0,1,"Skipped"
"what [[distinguishes]] time of favor from countless other thrillers is its underlying concern with the consequences of words and with the complicated emotions fueling terrorist acts . ","what [[diEstinguishes]] time of favor from countless other thrillers is its underlying concern with the consequences of words and with the complicated emotions fueling terrorist acts . ",0.004740297794342041,0.014278292655944824,1,1,1,643,"Failed"
"i do n't mind having my heartstrings pulled , but do n't treat me like a [[fool]] . ","i do n't mind having my heartstrings pulled , but do n't treat me like a [[foll]] . ",0.0531730055809021,0.2186686396598816,0,0,0,174,"Failed"
"the movie 's accumulated force still feels like an [[ugly]] knot tightening in your stomach . ","the movie 's accumulated force still feels like an [[ubly]] knot tightening in your stomach . ",0.1899396777153015,0.8886997103691101,0,1,0,294,"Successful"
"at least one scene is so disgusting that viewers may be hard pressed to retain their lunch . ","at least one scene is so disgusting that viewers may be hard pressed to retain their lunch . ",0.7377283573150635,0.7377283573150635,1,1,0,1,"Skipped"
"it has [[charm]] to spare , and unlike many romantic comedies , it does not alienate either gender in the audience . ","it has [[cahrm]] to spare , and unlike many romantic comedies , it does not alienate either gender in the audience . ",0.47735780477523804,0.8554592132568359,1,0,1,336,"Successful"
"an operatic , [[sprawling]] picture that 's entertainingly acted , magnificently shot and gripping enough to sustain most of its 170-minute length . ","an operatic , [[slrawling]] picture that 's entertainingly acted , magnificently shot and gripping enough to sustain most of its 170-minute length . ",0.01874840259552002,0.1036214828491211,1,1,1,538,"Failed"
"a [[giggle]] a minute . ","a [[goggle]] a minute . ",0.2532839775085449,0.47283679246902466,1,1,1,63,"Failed"
"uses [[sharp]] humor and insight into human nature to examine class conflict , adolescent yearning , the roots of friendship and sexual identity . ","uses [[sQharp]] humor and insight into human nature to examine class conflict , adolescent yearning , the roots of friendship and sexual identity . ",0.005107522010803223,0.027546226978302002,1,1,1,536,"Failed"
"the continued [[good]] chemistry between carmen and juni is what keeps this slightly disappointing sequel going , with enough amusing banter -- blessedly curse-free -- to keep both kids and parents entertained . ","the continued [[giod]] chemistry between carmen and juni is what keeps this slightly disappointing sequel going , with enough amusing banter -- blessedly curse-free -- to keep both kids and parents entertained . ",0.003409862518310547,0.0446740984916687,1,1,1,714,"Failed"
"i 'm just too [[bored]] to care . ","i 'm just too [[bord]] to care . ",0.004698753356933594,0.013601720333099365,0,0,0,38,"Failed"
"one of the more irritating cartoons you will see this , or any , year . ","one of the more irritating cartoons you will see this , or any , year . ",0.650638222694397,0.650638222694397,1,1,0,1,"Skipped"
"it 's one [[heck]] of a character study -- not of hearst or davies but of the unique relationship between them . ","it 's one [[hAeck]] of a character study -- not of hearst or davies but of the unique relationship between them . ",0.26429325342178345,0.6728165149688721,1,0,1,267,"Successful"
"it moves quickly , adroitly , and [[without]] fuss ; it does n't give you time to reflect on the inanity -- and the cold war datedness -- of its premise . ","it moves quickly , adroitly , and [[wCithout]] fuss ; it does n't give you time to reflect on the inanity -- and the cold war datedness -- of its premise . ",0.2522885203361511,0.6377788782119751,1,0,1,377,"Successful"
"i am sorry that i was unable to get the [[full]] brunt of the comedy . ","i am sorry that i was unable to get the [[ful]] brunt of the comedy . ",0.06143099069595337,0.1350002884864807,0,0,0,115,"Failed"
"a [[good]] piece of work more often than not . ","a [[gaood]] piece of work more often than not . ",0.1031532883644104,0.7414408922195435,1,0,1,73,"Successful"
"while the ideas about techno-saturation are far from [[novel]] , they 're presented with a wry dark humor . ","while the ideas about techno-saturation are far from [[nivel]] , they 're presented with a wry dark humor . ",0.0803106427192688,0.1398215889930725,1,1,1,252,"Failed"
"charles ' entertaining film chronicles seinfeld 's return to stand-up comedy after the wrap of his legendary sitcom , alongside wannabe comic adams ' attempts to get his shot at the big time . ","charles ' entertaining film chronicles seinfeld 's return to stand-up comedy after the wrap of his legendary sitcom , alongside wannabe comic adams ' attempts to get his shot at the big time . ",0.5360134840011597,0.5360134840011597,0,0,1,1,"Skipped"
"an [[exhilarating]] futuristic thriller-noir , minority report twists the best of technology around a gripping story , delivering a riveting , pulse intensifying escapist adventure of the first order ","an [[eDxhilarating]] futuristic thriller-noir , minority report twists the best of technology around a gripping story , delivering a riveting , pulse intensifying escapist adventure of the first order ",0.0011042356491088867,0.020386099815368652,1,1,1,856,"Failed"
"beautifully observed , miraculously [[unsentimental]] comedy-drama . ","beautifully observed , miraculously [[ubsentimental]] comedy-drama . ",0.01159125566482544,0.25596684217453003,1,1,1,351,"Failed"
"the film 's hackneyed message is not helped by the [[thin]] characterizations , nonexistent plot and pretentious visual style . ","the film 's hackneyed message is not helped by the [[thn]] characterizations , nonexistent plot and pretentious visual style . ",0.001599729061126709,0.029099643230438232,0,0,0,478,"Failed"
"a [[breezy]] romantic comedy that has the punch of a good sitcom , while offering exceptionally well-detailed characters . ","a [[bLreezy]] romantic comedy that has the punch of a good sitcom , while offering exceptionally well-detailed characters . ",0.03180199861526489,0.24785369634628296,1,1,1,429,"Failed"
"should have been [[someone]] else - ","should have been [[somone]] else - ",0.04280918836593628,0.13849300146102905,0,0,0,51,"Failed"
"[[coughs]] and sputters on its own postmodern conceit . ","[[cEoughs]] and sputters on its own postmodern conceit . ",0.06016260385513306,0.0892147421836853,0,0,0,176,"Failed"
"the lion [[king]] was a roaring success when it was released eight years ago , but on imax it seems better , not just bigger . ","the lion [[kong]] was a roaring success when it was released eight years ago , but on imax it seems better , not just bigger . ",0.045918822288513184,0.33367449045181274,1,1,1,295,"Failed"
"almost [[gags]] on its own gore . ","almost [[gas]] on its own gore . ",0.010609924793243408,0.17238253355026245,0,0,0,61,"Failed"
"a marvel like none you 've seen . ","a marvel like none you 've seen . ",0.7872404456138611,0.7872404456138611,0,0,1,1,"Skipped"
"trite , banal , cliched , mostly inoffensive . ","trite , banal , cliched , mostly inoffensive . ",0.6517800092697144,0.6517800092697144,1,1,0,1,"Skipped"
"immersing us in the endlessly inventive , fiercely competitive world of hip-hop djs , the project is sensational and [[revelatory]] , even if scratching makes you itch . ","immersing us in the endlessly inventive , fiercely competitive world of hip-hop djs , the project is sensational and [[rdvelatory]] , even if scratching makes you itch . ",0.032377004623413086,0.06295013427734375,1,1,1,603,"Failed"
"the movie has an [[infectious]] exuberance that will engage anyone with a passing interest in the skate/surf culture , the l.a. beach scene and the imaginative ( and sometimes illegal ) ways kids can make a playground out of the refuse of adults . ","the movie has an [[iBnfectious]] exuberance that will engage anyone with a passing interest in the skate/surf culture , the l.a. beach scene and the imaginative ( and sometimes illegal ) ways kids can make a playground out of the refuse of adults . ",0.059990525245666504,0.4117431640625,1,1,1,746,"Failed"
"yakusho and shimizu ... create engaging characterizations in imamura 's [[lively]] and enjoyable cultural mix . ","yakusho and shimizu ... create engaging characterizations in imamura 's [[lDively]] and enjoyable cultural mix . ",2.5033950805664062e-05,0.003377079963684082,1,1,1,441,"Failed"
"this is wild surreal stuff , but brilliant and the camera just kind of sits there and lets you look at this and its like you 're going from one room to the next and none of them have any relation to the other . ","this is wild surreal stuff , but brilliant and the camera just kind of sits there and lets you look at this and its like you 're going from one room to the next and none of them have any relation to the other . ",0.6838221549987793,0.6838221549987793,0,0,1,1,"Skipped"
"there is very little dread or apprehension , and though i like the creepy ideas , they are not executed with anything more than [[perfunctory]] skill . ","there is very little dread or apprehension , and though i like the creepy ideas , they are not executed with anything more than [[pdrfunctory]] skill . ",0.035319507122039795,0.2058582901954651,0,0,0,411,"Failed"
"the notion that bombing buildings is the funniest thing in the world goes entirely unexamined in this startlingly unfunny comedy . ","the notion that bombing buildings is the funniest thing in the world goes entirely unexamined in this startlingly unfunny comedy . ",0.5622434616088867,0.5622434616088867,1,1,0,1,"Skipped"
"[[good]] car chases , great fight scenes , and a distinctive blend of european , american and asian influences . ","[[gYood]] car chases , great fight scenes , and a distinctive blend of european , american and asian influences . ",0.0009340643882751465,0.03376877307891846,1,1,1,390,"Failed"
"the last 20 minutes are somewhat redeeming , but most of the movie is the same teenage american road-trip drek we 've seen before - only this time you have to read the [[fart]] jokes ","the last 20 minutes are somewhat redeeming , but most of the movie is the same teenage american road-trip drek we 've seen before - only this time you have to read the [[fat]] jokes ",0.30608534812927246,0.896080493927002,0,1,0,402,"Successful"
"even in its most tedious scenes , russian ark is [[mesmerizing]] . ","even in its most tedious scenes , russian ark is [[mUesmerizing]] . ",0.2624340057373047,0.7684556841850281,1,0,1,193,"Successful"
"with its dogged hollywood naturalism and the inexorable passage of its characters toward sainthood , windtalkers is [[nothing]] but a sticky-sweet soap . ","with its dogged hollywood naturalism and the inexorable passage of its characters toward sainthood , windtalkers is [[notting]] but a sticky-sweet soap . ",0.16321802139282227,0.4221564531326294,0,0,0,589,"Failed"
"generally , clockstoppers will fulfill your wildest fantasies about being a different kind of time [[traveler]] , while happily killing 94 minutes . ","generally , clockstoppers will fulfill your wildest fantasies about being a different kind of time [[tarveler]] , while happily killing 94 minutes . ",0.178480327129364,0.7082866430282593,1,0,1,496,"Successful"
"something akin to a japanese alice through the looking glass , except that it seems to take itself far more seriously . ","something akin to a japanese alice through the looking glass , except that it seems to take itself far more seriously . ",0.5763012170791626,0.5763012170791626,0,0,1,1,"Skipped"
"oh [[come]] on . ","oh [[coe]] on . ",0.3788193464279175,0.5443441867828369,0,1,0,13,"Successful"
"a moody , multi-dimensional love story and sci-fi mystery , solaris is a [[thought-provoking]] , haunting film that allows the seeds of the imagination to germinate . ","a moody , multi-dimensional love story and sci-fi mystery , solaris is a [[tbought-provoking]] , haunting film that allows the seeds of the imagination to germinate . ",0.09926491975784302,0.32493191957473755,1,1,1,616,"Failed"
"not only are the special effects and narrative flow much improved , and [[daniel]] radcliffe more emotionally assertive this time around as harry , but the film conjures the magic of author j.k. rowling 's books . ","not only are the special effects and narrative flow much improved , and [[dabiel]] radcliffe more emotionally assertive this time around as harry , but the film conjures the magic of author j.k. rowling 's books . ",0.3561519980430603,0.9525423645973206,1,0,1,637,"Successful"
"it 's clear the filmmakers were n't sure where they wanted their story to go , and even more clear that they [[lack]] the skills to get us to this undetermined destination . ","it 's clear the filmmakers were n't sure where they wanted their story to go , and even more clear that they [[lak]] the skills to get us to this undetermined destination . ",0.22866326570510864,0.6094536781311035,0,1,0,373,"Successful"
"( t ) his beguiling belgian fable , very much its own [[droll]] and delicate little film , has some touching things to say about what is important in life and why . ","( t ) his beguiling belgian fable , very much its own [[dAroll]] and delicate little film , has some touching things to say about what is important in life and why . ",0.05553901195526123,0.08814728260040283,1,1,1,384,"Failed"
"even on those rare occasions when the narrator stops yammering , miller 's [[hand]] often feels unsure . ","even on those rare occasions when the narrator stops yammering , miller 's [[hamd]] often feels unsure . ",0.19789868593215942,0.35465842485427856,0,0,0,310,"Failed"
"( chaiken 's ) talent lies in an [[evocative]] , accurate observation of a distinctive milieu and in the lively , convincing dialogue she creates for her characters . ","( chaiken 's ) talent lies in an [[eSvocative]] , accurate observation of a distinctive milieu and in the lively , convincing dialogue she creates for her characters . ",4.374980926513672e-05,0.001221001148223877,1,1,1,587,"Failed"
"sticky sweet sentimentality , clumsy plotting and a rosily myopic view of life in the wwii-era mississippi delta undermine this adaptation . ","sticky sweet sentimentality , clumsy plotting and a rosily myopic view of life in the wwii-era mississippi delta undermine this adaptation . ",0.7733679413795471,0.7733679413795471,1,1,0,1,"Skipped"
